,,,,,US-en,US-en,MX-es,MX-es,BR-pt,BR-pt,RU-ru,RU-ru,UK-uk,UK-uk,DE-de,DE-de,FR-fr,FR-fr,ID-id,ID-id,KR-ko,KR-ko,VN-vi,VN-vi,JP-ja,JP-ja,IT-it,IT-it,IN-hi,IN-hi,TH-th,TH-th,MS-ms,MS-ms,UAE-ar,UAE-ar
Month,Date,Sale-off,Global,Time,Title,Description,Title,Description,Title,Description,Title,Description,Title,Description,Title,Description,Title,Description,Title,Description,Title,Description,Title,Description,Title,Description,Title,Description,Title,Description,Title,Description,Title,Description,Title,Description
1,1,50%,Happy New Year!,9h,💥[SHOCK] NEW YEAR SALE -50%💥,Super Sale Only Today 👉,💥 [SHOCK] OFERTA DE AÑO NUEVO -50% 💥,Super venta solo hoy 👉,💥 [CHOQUE] PROMOÇÃO DE ANO NOVO -50% 💥,Super venda apenas hoje 👉,💥 [SHOCK] НОВОГОДНЯЯ РАСПРОДАЖА -50% 💥,Супер распродажа только сегодня 👉,💥 [ШОК] НОВОРІЧНИЙ РОЗПРОДАЖ -50% 💥,Супер розпродаж тільки сьогодні 👉,💥 [SCHOCK] NEUJAHR SALE -50% 💥,Nur heute Super Sale 👉,💥 [SHOCK] VENTE DU NOUVEL AN -50% 💥,Super vente seulement aujourd'hui 👉,💥 [SHOCK] PROMO TAHUN BARU -50% 💥,Super Sale Hanya Hari Ini 👉,💥 [쇼크] 새해 세일 -50% 💥,오늘만 슈퍼세일 👉,💥 [SỐC] GIẢM GIÁ NĂM MỚI -50% 💥,Siêu giảm giá duy nhất hôm nay 👉,💥[SHOCK] 新年 セール-50％💥,今日だけのスーパーセール👉,💥 [SHOCK] CAPODANNO SALDI -50% 💥,Super saldi solo oggi 👉,💥 [झटका] नए साल की बिक्री -50% 💥,सुपर सेल केवल आज 👉,💥 [ช็อค] ลดราคาปีใหม่ -50% 💥,Super Sale วันนี้เท่านั้น 👉,💥 [GEMPAR] TAHUN BARU SALE -50% 💥,Jualan Super Sahaja Hari Ini 👉,💥 [صدمة] تخفيضات ليلة رأس السنة الجديدة -50٪ 💥,سوبر بيع اليوم فقط 👉
1,1,50%,Happy New Year!,15h,🎆HAPPY NEW YEAR🎆 50% OFF,Hurry Up to Grab the DEAL 👉,🎆FELIZ AÑO NUEVO🎆 50% DE DESCUENTO,Date prisa para conseguir un buen trato 👉,🎆FELIZ ANO NOVO🎆 50% DE DESCONTO,Corra para pegar o HOT DEAL 👉,🎆 С НОВЫМ ГОДОМ 🎆 СКИДКА 50%,Спешите получить ГОРЯЧЕЕ ПРЕДЛОЖЕНИЕ 👉,🎆 Щасливого Нового року 🎆 ЗНИЖКА 50%.,Поспішайте отримати ГАРЯЧУ ПРОГРАМУ 👉,GLÜCKLICHES NEUES JAHR!,"Beeilen Sie sich, um den HOT DEAL zu sichern 👉",🎆 BONNE ANNÉE 🎆 50% DE RÉDUCTION,Dépêchez-vous de saisir le HOT DEAL 👉,🎆 SELAMAT TAHUN BARU 🎆 DISKON 50%,Cepat Dapatkan HOT DEAL 👉,🎆새해 복 많이 받으세요🎆 50% 할인,HOT DEAL 서두르세요 👉,🎆 MỪNG NĂM MỚI 🎆 GIẢM NGAY 50%,Hãy Nhanh Tay Để Nhận ƯU ĐÃI HẤP DẪN 👉,🎆 あけましておめでとう！🎆 50％オフ,急いでホットディールを手に入れよう👉,🎆 BUON ANNO 🎆 50% DI SCONTO,Sbrigati a prendere l'OFFERTA HOT 👉,🎆 नववर्ष की सदस्यता 🎆 50% की छूट,हॉट डील हासिल करने के लिए जल्दी करें 👉,🎆 สวัสดีปีใหม่ 🎆 50% OFF,รีบคว้าข้อเสนอสุดฮอต 👉,🎆 SELAMAT TAHUN BARU 🎆 DISKAUN 50%.,Cepat Dapatkan TAWARAN PANAS 👉,🎆سنه جديده سعيده 🎆 خصم 50٪,سارع للاستيلاء على HOT DEAL 👉
1,1,50%,Happy New Year!,20h,OOPS! Flash Sale ending soon 😱😱,DON'T MISS IT 👉,"¡Oh, no! La venta flash finalizará pronto 😱😱",NO TE LO PIERDAS 👉,OH NÃO! Promoção relâmpago terminando em breve 😱😱,NÃO PERCA 👉,"О, НЕТ! Флэш-распродажа скоро закончится 😱😱",НЕ ПРОПУСТИТЕ 👉,О НІ! Флеш-розпродаж незабаром закінчиться 😱😱,НЕ ПРОПУСТІТЬ 👉,ACH NEIN! Flash Sale endet bald 😱😱,NICHT VERPASSEN 👉,OH NON! La vente flash se termine bientôt 😱😱,A NE PAS MANQUER 👉,OH TIDAK! Flash Sale akan segera berakhir 😱😱,JANGAN LEWATKAN 👉,안 돼! 플래시 세일이 곧 종료됩니다 😱😱,놓치지 마세요 👉,OOPS! Flash Sale sắp kết thúc 😱😱,ĐỪNG BỎ LỠ 👉,大野！ フラッシュセールはまもなく終了します😱😱,お見逃しなく👉,OOPS! La vendita flash sta per terminare 😱😱,DA NON PERDERE 👉,नहीं ओ! फ्लैश सेल जल्द खत्म हो रही है 😱😱,इसे मिस न करें 👉,ไม่นะ! Flash Sale ใกล้หมดเขตแล้ว 😱😱,ห้ามพลาด 👉,OH TIDAK! Flash Sale akan tamat tidak lama lagi 😱😱,JANGAN LEPASKAN 👉,أوه لا! بيع فلاش سينتهي قريبًا 😱😱,لا تفوتها 👉
1,11,30%,Flash Sale,9h,SUPER SALE ONLY TODAY 🏷️🏷️,"SALE OFF -30%, for only loyalty users 👉🏼",SUPER VENTA SOLO HOY 🏷️🏷️,"VENTA DE DESCUENTO -30%, solo para usuarios fieles 👉🏼",SUPER VENDA SÓ ​​HOJE ️🏷️,"VENDA OFF -30%, apenas para usuários fiéis 👉🏼",СУПЕР ПРОДАЖА ТОЛЬКО СЕГОДНЯ ️🏷️,"СКИДКА -30%, только постоянным пользователям 👉🏼",СУПЕР РОЗПРОДАЖ ТІЛЬКИ СЬОГОДНІ ️🏷️,"ЗНИЖКА -30%, тільки для постійних користувачів 👉🏼",SUPER SALE NUR HEUTE ️🏷️,"SALE OFF -30%, nur für treue Benutzer 👉🏼",SUPER VENTE UNIQUEMENT AUJOURD'HUI ️🏷️,"PROMO -30%, réservé aux utilisateurs fidèles 👉🏼",SUPER SALE HANYA HARI INI ️🏷️,"SALE OFF -30%, hanya untuk pengguna setia 👉🏼",오늘만 슈퍼세일 ️🏷️,"SALE OFF -30%, 충성도가 높은 사용자만 👉🏼",SIÊU SALE CHỈ CÒN HÔM NAY 🏷️🏷️,"SALE OFF -30%, chỉ dành cho người dùng trung thành 👉🏼",今日だけのスーパーセール️🏷️🏷️,セールオフ-30％、忠実なユーザーのみ👉🏼,SUPER VENDITA SOLO OGGI ️🏷️,"VENDITA -30%, solo per utenti fedeli 👉🏼",सुपर सेल केवल आज ️🏷️,"बिक्री -30%, केवल वफादार उपयोगकर्ताओं के लिए 👉🏼",SUPER SALE วันนี้เท่านั้น ️🏷️🏷️,SALE -30% สำหรับผู้ใช้ที่ภักดีเท่านั้น 👉🏼,SUPER SALE HANYA HARI INI ️🏷️🏷️,"SALE -30%, untuk pengguna setia sahaja 👉🏼",بيع سوبر فقط اليوم ️🏷️🏷️,تخفيضات -30٪ فقط للمستخدمين الأوفياء 👉🏼
1,11,30%,Flash Sale,15h,ONLY 100 Coupons for The Fastest 🏷️🏷️,Hurry Up to Grab the DEAL 👉,SOLO quedan 100 cupones para la persona MÁS RÁPIDA 🏷️🏷️,Obtenga rápidamente la OFERTA ahora 👉,APENAS 100 cupons para a pessoa mais rápida ️🏷️,Obtenha o CUPON agora mesmo 👉,ТОЛЬКО 100 купонов для самого быстрого ️🏷️,Получите ВАУЧЕР прямо сейчас 👉,ТІЛЬКИ 100 купонів для найшвидшої людини ️🏷️,Отримайте ВАУЧЕР прямо зараз 👉,NUR 100 Gutscheine für die schnellste Person ️🏷️,Hol dir jetzt den GUTSCHEIN 👉,SEULEMENT 100 coupons pour la personne la plus rapide ️🏷️,Obtenez le BON dès maintenant 👉,HANYA 100 Kupon untuk Orang Tercepat ️🏷️,Dapatkan VOUCHERnya sekarang juga 👉,가장 빠른 사람을 위한 단 100개의 쿠폰 ️🏷️,지금 바로 바우처 받기 👉,CHỈ 100 Phiếu Giảm Giá cho Người Nhanh Nhất 🏷️🏷️,Nhanh tay nhận DEAL ngay 👉,最速の人のためのたった100枚のクーポン️🏷️🏷️,クーポンを入手👉,SOLO 100 coupon per la persona più veloce ️🏷️,Ottieni COUPON 👉,सबसे तेज़ व्यक्ति के लिए केवल 100 कूपन ️🏷️,कूपन प्राप्त करें 👉,100 คูปองเท่านั้น สำหรับคนที่เร็วที่สุด ️🏷️🏷️,รับคูปอง 👉,HANYA 100 Kupon untuk Orang Terpantas ️🏷️🏷️,Dapatkan KUPON 👉,100 كوبون فقط لأسرع شخص ️🏷️🏷️,احصل على كوبون 👉
1,11,30%,Flash Sale,20h,ONLY 20 Coupon Left 🏷️🏷️,Open to catch your Flash Sale👉,Solo 20 Cupones Restantes 🏷️🏷️,Abierto para ponerse al día con Quick Deals 👉,SOMENTE 20 cupons restantes 🏷️🏷️,Abra para pegar o seu negócio rápido 👉,Осталось ТОЛЬКО 20 купонов 🏷️🏷️,"Откройте, чтобы поймать вашу быструю сделку 👉",Залишилося ЛИШЕ 20 купонів 🏷️🏷️,"Відкрийте, щоб отримати швидку пропозицію 👉",NUR 20 Gutschein übrig ️🏷️,"Öffnen Sie, um Ihren Quick Deal zu fangen 👉",SEULEMENT 20 coupons restants 🏷️🏷️,Ouvrez pour profiter de votre offre rapide 👉,HANYA 20 Kupon Tersisa ️🏷️,Buka untuk mendapatkan Penawaran Cepat Anda 👉,🏷️🏷️ 쿠폰 20개 남았습니다.,오픈하여 퀵딜을 잡으세요 👉,CHỈ CÒN 20 Coupon 🏷️🏷️,Mở để đón Ưu đãi 👉,残りわずか20クーポン🏷️🏷️,クーポンを取得するために開きます👉,SOLO 20 Coupon rimasti 🏷️🏷️,Apri per ottenere il Coupon 👉,केवल 20 कूपन बचे हैं ️🏷️,कूपन प्राप्त करने के लिए खुला 👉,เหลือเพียง 20 คูปอง 🏷️🏷️,เปิดรับคูปอง 👉,Tinggal 20 Kupon SAHAJA 🏷️🏷️,Buka untuk dapatkan Kupon 👉,بقي 20 قسيمة فقط 🏷️🏷️,افتح لتحصل على القسيمة 👉
2,2,50%,Flash Sale 2:2,9h,🔥 ONLY chance to discount -50% 🔥,"Catch it, catch it now 👉🏼",🔥 SOLO 1 día: descuento -50% 🔥,"Cógelo, cógelo ahora 👉🏼",🔥 APENAS 1 DIA: desconto -50% 🔥,Cadastre-se agora 👉🏼,🔥 ТОЛЬКО 1 ДЕНЬ: скидка -50% 🔥,Присоединяйтесь сейчас 👉🏼,🔥 ТІЛЬКИ 1 ДЕНЬ: знижка -50% 🔥,Приєднуйтесь зараз 👉🏼,🔥 NUR 1 TAG: Rabatt -50% 🔥,Jetzt mitmachen 👉🏼,🔥 SEULEMENT 1 JOUR : remise -50% 🔥,Inscrivez-vous maintenant 👉🏼,🔥 HANYA 1 HARI: diskon -50% 🔥,Gabung sekarang 👉🏼,🔥 단 하루: 할인 -50% 🔥,지금 바로 참여하세요 👉🏼,🔥 CƠ HỘI giảm giá -50% DUY NHẤT🔥,Tham gia ngay 👉🏼,🔥たった1日：割引-50％🔥,キャッチ、今すぐキャッチ👉🏼,🔥 SOLO 1 GIORNO: sconto -50% 🔥,"Prendilo, prendilo ora 👉🏼",🔥 केवल 1 दिन: छूट -50% 🔥,"इसे पकड़ो, इसे अभी पकड़ो 👉🏼",🔥 1 วันเท่านั้น: ลด -50% 🔥,จับเลย จับเลย👉🏼,🔥 HANYA 1 HARI: diskaun -50% 🔥,"Tangkap, tangkap sekarang 👉🏼",🔥 يوم واحد فقط: خصم -50٪,قبض عليه ، قبض عليه الآن 👉🏼
2,2,50%,Flash Sale 2:3,15h,🔥 SALE OFF -50% 🔥,Open to catch your Flash Sale👉,🔥 VENTA DE -50% 🔥,Abierta para atrapar tu venta Flash👉,🔥 VENDA OFF -50% 🔥,Aberto para participar da Promoção Flash👉,🔥 СКИДКА -50% 🔥,"Открыт, чтобы присоединиться к Flash Sale👉",🔥 ЗНИЖКА -50% 🔥,Відкрийте для участі у Flash Sale👉,🔥 AUSVERKAUF -50% 🔥,Offen für Flash Sale👉,🔥 VENTE OFFERTE -50% 🔥,Ouvert pour rejoindre la Vente Flash👉,🔥 DISKON PENJUALAN -50% 🔥,Terbuka untuk bergabung dengan Flash Sale👉,🔥 세일 -50% 🔥,플래시세일 참여하기👉,🔥 GIẢM GIÁ -50% 🔥,Nhấn để tham gia Flash Sale👉,🔥セールオフ-50％🔥,フラッシュセールに参加するために開いてください👉,🔥 SCONTO -50% 🔥,Apri per partecipare alla vendita flash👉,🔥 बिक्री बंद -50% 🔥,फ्लैश सेल में शामिल होने के लिए तैयार 👉,🔥 ลดราคา -50% 🔥,เปิดให้เข้าร่วม Flash Sale👉,🔥 JUALAN DISKAUN -50% 🔥,Terbuka untuk menyertai Jualan Kilat👉,🔥 تخفيضات البيع -50٪ 🔥,افتح للانضمام إلى Flash Sale👉
2,2,50%,Flash Sale 2:4,20h,OOPS! Flash Sale 2:2 Ending Soon 😱😱,Hurry Up! Don't miss it 👉🏼,"¡Oh, no! Venta flash 2: 2 que finalizará pronto 😱😱",¡Darse prisa! No te lo pierdas 👉🏼,Oh não! Venda instantânea 2: 2 acabando em breve 😱😱,Se apresse! Não perca 👉🏼,"О, нет! Флэш-распродажа 2: 2 скоро закончатся 😱😱",Торопиться! Не пропустите 👉🏼,О ні! Flash Sale 2:2 Незабаром закінчиться 😱😱,Поспішай! Не пропустіть 👉🏼,Ach nein! Flash Sale 2:2 endet bald 😱😱,Beeil dich! Nicht verpassen 👉🏼,Oh non! Vente Flash 2:2 se terminant bientôt 😱😱,Dépêchez-vous! Ne le manquez pas 👉🏼,Oh tidak! Flash Sale 2:2 Segera Berakhir 😱😱,Percepat! Jangan sampai ketinggalan 👉🏼,안 돼! 2:2 플래시 세일이 곧 종료됩니다 😱😱,서둘러 요! 놓치지 마세요 👉🏼,Ơ KÌA! Flash Sale 2:2 Sắp Kết Thúc 😱😱,Nhanh lên! Đừng bỏ lỡ nhé 👉🏼,大野！ フラッシュセール2：2間もなく終了😱😱,急げ！ お見逃しなく👉🏼,Oh no! Vendita flash 2:2 che sta per finire 😱😱,Affrettarsi! Non mancare 👉🏼,नहीं ओ! फ्लैश सेल 2:2 जल्द खत्म हो रही है 😱😱,जल्दी से! इसे याद मत करो 👉🏼,ไม่นะ! Flash Sale 2:2 ใกล้จะสิ้นสุดแล้ว 😱😱,รีบขึ้น! ห้ามพลาด 👉🏼,Oh tidak! Jualan Kilat 2:2 Akan Berakhir Tidak Lama Lagi 😱😱,Cepat! Jangan ketinggalan 👉🏼,أوه لا! تنزيلات فلاش 2:2 تنتهي قريبًا 😱😱,عجلوا! لا تفوتها 👉🏼
2,13-14,30%,Happy Valentine's Day!,9h,💖[HOT] Valentine's Day SALE -30% 💖,ONLY 100 Coupons for The Fastest 🏷️,💖[HOT] Valentine's Day SALE -30% 💖,SOLO quedan 100 cupones para la persona MÁS RÁPIDA 🏷️,💖 [HOT] VENDA DO Dia dos Namorados -30% 💖,APENAS 100 cupons para a pessoa mais rápida ️🏷️,💖 [HOT] СКИДКИ на День святого Валентина -30% 💖,ТОЛЬКО 100 купонов для самого быстрого ️🏷️,💖[ГАРЯЧЕ] РОЗПРОДАЖ до Дня Святого Валентина -30% 💖,ТІЛЬКИ 100 купонів для найшвидшої людини ️🏷️,💖[HOT] Valentinstag SALE -30% 💖,NUR 100 Gutscheine für die schnellste Person ️🏷️,💖[HOT] SOLDE Saint Valentin -30% 💖,SEULEMENT 100 coupons pour la personne la plus rapide ️🏷️,💖 [HOT] PROMO Hari Valentine -30% 💖,HANYA 100 Kupon untuk Orang Tercepat ️🏷️,💖[HOT] 발렌타인데이 세일 -30% 💖,가장 빠른 사람을 위한 단 100개의 쿠폰 ️🏷️,💖 [HOT] GIẢM GIÁ 30% Ngày Valentine💖,CHỈ 100 Phiếu Giảm Giá cho Người Nhanh Nhất 🏷️🏷️,💖[HOT]バレンタインデーセール-30％💖,最速の人のためのたった100枚のクーポン️🏷️🏷️,💖[HOT] SCONTI di San Valentino -30% 💖,SOLO 100 coupon per la persona più veloce ️🏷️,💖 [हॉट] वैलेंटाइन डे सेल -30% 💖,सबसे तेज़ व्यक्ति के लिए केवल 100 कूपन ️🏷️,💖 [HOT] ลดราคาวันวาเลนไทน์ -30% 💖,100 คูปองเท่านั้น สำหรับคนที่เร็วที่สุด ️🏷️🏷️,💖 [PANAS] JUALAN Hari Valentine -30% 💖,HANYA 100 Kupon untuk Orang Terpantas ️🏷️🏷️,💖 تخفيضات عيد الحب [HOT] -30٪ 💖,100 كوبون فقط لأسرع شخص ️🏷️🏷️
2,13-14,30%,Happy Valentine's Day!,15h,ONLY 50 Coupon Left 🏷️🏷️🏷️,Don't miss the chance 👉,Solo 50 Cupones Restantes 🏷️🏷️,No pierdas la oportunidad 👉,SOMENTE 50 cupom restantes 🏷️🏷️🏷️,Não perca a chance 👉,Осталось ТОЛЬКО 50 купонов 🏷️🏷️🏷️,Не упустите шанс 👉,Залишилося ЛИШЕ 50 купонів 🏷️🏷️🏷️,Не прогавте шанс 👉,NUR 50 Gutschein übrig ️🏷️🏷️,Verpasse nicht die Chance 👉,SEULEMENT 50 coupons restants 🏷️🏷️🏷️,Ne manquez pas l'occasion 👉,HANYA 50 Kupon Tersisa ️🏷️🏷️,Jangan lewatkan kesempatan 👉,쿠폰 50개 남았습니다 🏷️🏷️🏷️,기회를 놓치지 마세요 👉,CHỈ CÒN 50 Phiếu Giảm Giá 🏷️🏷️🏷️,Đừng bỏ lỡ cơ hội 👉,残りわずか50クーポン🏷️🏷️🏷️,チャンスをお見逃しなく👉,SOLO 50 Coupon rimasti 🏷️🏷️🏷️,Non perdere l'occasione 👉,केवल 50 कूपन बचे हैं ️🏷️🏷️,मौका न चूकें 👉,เหลือเพียง 50 คูปอง 🏷️🏷️🏷️,อย่าพลาดโอกาส 👉,Tinggal 50 Kupon SAHAJA 🏷️🏷️🏷️,Jangan lepaskan peluang 👉,بقي 50 كوبون فقط 🏷️🏷️🏷️,لا تفوت الفرصة 👉
2,13-14,30%,Happy Valentine's Day!,20h,HURRY! Super Sale is waiting 💜💜,Happy Valentine's Day! SALE OFF -30% 👉,¡APURARSE! Super venta está esperando 💜💜,¡Feliz día de San Valentín! VENTA DE DESCUENTO -30% 👉,PRESSA! Super Sale está esperando 💜💜,Feliz Dia dos namorados! VENDA OFF -30% 👉,ТОРОПИТЬСЯ! Супер распродажа ждет 💜💜,Счастливого дня Святого Валентина! СКИДКА -30% 👉,ПОСПІШАЙТЕСЬ! Супер розпродаж чекає💜💜,З Днем Святого Валентина! ЗНИЖКА -30% 👉,EILE! Super Sale wartet 💜💜,Fröhlichen Valentinstag! AUSVERKAUF -30% 👉,SE PRESSER! La Super Vente vous attend 💜💜,Joyeuse saint Valentin! VENTE OFFERTE -30% 👉,BURU-BURU! Super Sale sedang menunggu 💜💜,Selamat Hari Valentine! DISKON PENJUALAN -30% 👉,서두르다! 슈퍼세일이 기다리고 있습니다 💜💜,행복한 발렌타인 데이! 세일 -30% 👉,NHANH LÊN! Siêu Giảm Giá đang đợi 💜💜,Mừng Lễ Tình Nhân ❤ ️! GIẢM GIÁ -30% 👉,忙しい！ スーパーセールが待っています💜💜,ハッピーバレンタインデー！ セールオフ-30％👉,FRETTA! La Super Saldi sta aspettando 💜💜,Buon San Valentino! SALDI -30% 👉,जल्दी कीजिये! सुपर सेल इंतज़ार कर रही है 💜💜,वैलेंटाइन्स दिवस मुबारक हो! बिक्री बंद -30% 👉,รีบ! ซุปเปอร์เซลรออยู่ 💜💜,สุขสันต์วันวาเลนไทน์! ลดราคา -30% 👉,CEPAT! Jualan Super sedang menanti 💜💜,Selamat Hari kekasih! JUALAN DISKAUN -30% 👉,عجل! Super Sale ينتظر 💜💜,عيد حب سعيد! بيع قبالة -30٪ 👉
3,6&8,30%,Happy Women's Day!,9h,💎[SHOCK] Women's Day SALE -30% 💎,ONLY chance to discount -30% 🔥,💎 [SHOCK] OFERTA Del Día De La Mujer -30% 💎,ÚNICA posibilidad de descuento -30% 🔥,💎 [CHOQUE] VENDA Dia da Mulher -30% 💎,SÓ chance de desconto -30% 🔥,💎 [SHOCK] СКИДКИ на женский день -30% 💎,ТОЛЬКО шанс на скидку -30% 🔥,💎[ШОК] РОЗПРОДАЖ до жіночого дня -30% 💎,ТІЛЬКИ шанс на знижку -30% 🔥,💎[SHOCK] Frauentag SALE -30% 💎,NUR Chance auf Rabatt -30% 🔥,💎[SHOCK] SOLDE Journée de la Femme -30% 💎,SEULE chance de remise -30% 🔥,💎 [SHOCK] Obral Hari Wanita -30% 💎,HANYA kesempatan untuk diskon -30% 🔥,💎[SHOCK] 여성의 날 SALE -30% 💎,-30% 할인할 수 있는 유일한 기회 🔥,💎 [SỐC] SALE Ngày Quốc Tế Phụ Nữ -30% 💎,Cơ hội DUY NHẤT để được giảm -30% 🔥,💎[SHOCK]女性の日セール-30％💎,-30％割引のチャンスのみ🔥,💎[SHOCK] SALDI per la festa della donna -30% 💎,SOLO possibilità di sconto -30% 🔥,💎[झटका] महिला दिवस बिक्री -30% 💎,छूट का केवल मौका -30% 🔥,💎[ช็อค] ลดราคาวันสตรี -30% 💎,โอกาสเดียวลด -30% 🔥,💎[GEMPAR] JUALAN Hari Wanita -30% 💎,HANYA peluang diskaun -30% 🔥,💎 [صدمة] تخفيضات يوم المرأة -30٪ 💎,فرصة فقط للخصم -30٪ 🔥
3,6&8,30%,Happy Women's Day!,15h,🎉[HOT] Women's Day SALE -30% 🎉,Hurry Up! Only 50 coupons left 👉,🎉 [HOT] OFERTA del Día de la Mujer -30% 🎉,¡Darse prisa! Solo quedan 50 cupones 👉,🎉 [QUENTE] VENDA Dia da Mulher -30% 🎉,Se apresse! Restam apenas 50 cupons 👉,🎉 [HOT] СКИДКИ на женский день -30% 🎉,Торопиться! Осталось всего 50 купонов 👉,🎉[ГАРЯЧИЙ] РОЗПРОДАЖ до жіночого дня -30% 🎉,Поспішай! Залишилося всього 50 купонів 👉,🎉[HOT] Frauentag SALE -30% 🎉,Beeil dich! Nur noch 50 Coupons übrig 👉,🎉[HOT] VENTE Journée de la Femme -30% 🎉,Dépêchez-vous! Plus que 50 coupons 👉,🎉 [HOT] PROMO Hari Wanita -30% 🎉,Percepat! Hanya tersisa 50 kupon 👉,🎉[HOT] 여성의 날 SALE -30% 🎉,서둘러 요! 쿠폰 50장 남았습니다 👉,🎉 [HOT] GIẢM GIÁ -30% cho Ngày 8/3 🎉,Nhanh lên! Chỉ còn 50 suất 👉,🎉[HOT]女性の日セール-30％🎉,急げ！ 残りわずか50クーポン👉,🎉[HOT] SCONTI per la festa della donna -30% 🎉,Affrettarsi! Rimangono solo 50 coupon 👉,🎉[HOT] महिला दिवस बिक्री -30% 🎉,जल्दी से! केवल 50 कूपन बचे हैं 👉,🎉[HOT] ลดราคาวันสตรี -30% 🎉,รีบขึ้น! เหลือเพียง 50 คูปองเท่านั้น 👉,🎉[HOT] JUALAN Hari Wanita -30% 🎉,Cepat! Hanya tinggal 50 kupon sahaja 👉,🎉 تخفيضات يوم المرأة [HOT] -30٪ 🎉,عجلوا! بقي 50 كوبون فقط 👉
3,6&8,30%,Happy Women's Day!,20h,🥂GIFT For All Ladies 🥂,Check out your gift voucher -30% 👉,🥂 REGALO para todas las damas 🥂,Consulta tu bono regalo -30% 👉,🥂GIFT para todas as senhoras 🥂,Confira seu vale-presente -30% 👉,🥂 ПОДАРОК всем дамам,Проверьте свой подарочный сертификат -30% 👉,🥂ПОДАРУНОК для всіх жінок 🥂,Перевірте свій подарунковий ваучер -30% 👉,🥂GESCHENK für alle Damen 🥂,Schau dir deinen Geschenkgutschein an -30% 👉,CADEAU pour toutes les dames🥂,Découvrez votre bon cadeau -30% 👉,🥂 HADIAH Untuk Semua Wanita 🥂,Lihat voucher hadiah Anda -30% 👉,🥂모든 여성을 위한 선물 🥂,상품권 확인 -30% 👉,🥂QUÀ TẶNG cho phái đẹp 🥂,Kiểm tra phiếu quà tặng của bạn -30% 👉,🥂すべての女性へのギフト🥂,ギフト券をチェックしてください-30％👉,🥂REGALO per tutte le donne 🥂,Scopri il tuo buono regalo -30% 👉,🥂 सभी महिलाओं के लिए उपहार 🥂,अपना उपहार वाउचर देखें -30% 👉,🥂ของขวัญสำหรับผู้หญิงทุกคน🥂,ตรวจสอบบัตรกำนัลของคุณ -30% 👉,🥂HADIAH Untuk Semua Wanita 🥂,Semak baucar hadiah anda -30% 👉,🥂هدية لجميع السيدات 🥂,تحقق من قسيمة الهدية الخاصة بك -30٪ 👉
