,,,,,US-en,US-en,MX-es,MX-es,BR-pt,BR-pt,RU-ru,RU-ru,UK-uk,UK-uk,DE-de,DE-de,FR-fr,FR-fr,ID-id,ID-id,KR-ko,KR-ko,VN-vi,VN-vi,JP-ja,JP-ja,IT-it,IT-it,IN-hi,IN-hi,TH-th,TH-th,MS-ms,MS-ms,UAE-ar,UAE-ar
4,22,30%,Earth Day!,9h,❌ YOU HAVE ONE LAST CHANCE!!!,Open to catch your Flash Sale 👉,❌ TIENE UNA ÚLTIMA OPORTUNIDAD !!!,Abierto para atrapar su venta flash 👉,❌ VOCÊ TEM UMA ÚLTIMA OPORTUNIDADE !!!,Abra para pegar sua venda relâmpago 👉,❌ У ВАС ЕСТЬ ОДИН ПОСЛЕДНИЙ ШАНС !!!,"Откройте, чтобы поймать вашу флеш-распродажу 👉",❌ У ВАС Є ОСТАННІЙ ШАНС!!!,Відкрийте для себе флеш-розпродаж 👉,❌ DU HAST EINE LETZTE CHANCE!!!,"Öffnen Sie, um Ihren Flash-Sale zu fangen 👉",❌ VOUS AVEZ UNE DERNIÈRE CHANCE !!!,Ouvert pour profiter de votre Vente Flash 👉,❌ ANDA MEMILIKI SATU KESEMPATAN TERAKHIR!!!,Buka untuk mendapatkan Flash Sale Anda 👉,❌ 마지막 기회가 있습니다!!!,오픈하여 플래시 세일 👉,❌ BẠN CÓ MỘT CƠ HỘI CUỐI CÙNG !!!,Mở ứng dụng để đón Flash Sale 👉,❌最後のチャンスが1つあります!!!,フラッシュセールをキャッチするために開いてください👉,❌ HAI UN'ULTIMA POSSIBILITA'!!!,Apri per catturare la tua vendita flash 👉,❌ आपके पास एक आखिरी मौका है!!!,अपनी फ्लैश सेल को पकड़ने के लिए खोलें 👉,❌ โอกาสสุดท้ายแล้ว !!!,เปิดแอพเพื่อจับ Flash Sale 👉,❌ ANDA ADA SATU PELUANG TERAKHIR!!!,Buka aplikasi untuk mendapatkan Jualan Kilat anda 👉,❌ لديك فرصة أخيرة !!!,افتح التطبيق لالتقاط عرض الفلاش الخاص بك 👉
4,22,30%,Earth Day!,15h,The Last Day To Get Your Gift 😱😱,Don't miss this chance 👉,El último día para recibir tu regalo 😱😱,No pierdas esta oportunidad 👉,O último dia para receber seu presente 😱😱,Não perca essa chance 👉,Последний день для получения подарка 😱😱,Не упустите этот шанс 👉,"Останній день, щоб отримати свій подарунок 😱😱",Не пропустіть цей шанс 👉,"Der letzte Tag, um dein Geschenk zu bekommen 😱😱",Verpasse diese Chance nicht 👉,Le dernier jour pour recevoir votre cadeau,Ne manquez pas cette chance 👉,Hari Terakhir Untuk Mendapatkan Hadiah Anda 😱😱,Jangan lewatkan kesempatan ini 👉,선물 받는 마지막 날 😱😱,이번 기회를 놓치지 마세요 👉,Ngày cuối cùng để bạn vào nhận quà 😱😱,Đừng bỏ lỡ cơ hội này 👉,贈り物をもらう最後の日😱😱,このチャンスをお見逃しなく👉,L'ultimo giorno per ricevere il tuo regalo 😱😱,Non perdere questa occasione 👉,अपना उपहार प्राप्त करने का अंतिम दिन 😱😱,यह मौका न चूकें 👉,วันสุดท้ายในการรับของขวัญ 😱😱,อย่าพลาดโอกาสนี้ 👉,Hari Terakhir Untuk Mendapat Hadiah Anda 😱😱,Jangan lepaskan peluang ini 👉,آخر يوم للحصول على هديتك 😱😱,لا تفوت هذه الفرصة 👉
4,22,30%,Earth Day!,20h,☄️☄️ HURRY!! The Earth Day Sale Ending Soon,...and your Coupon will run out 😱,☄️☄️ ¡¡PRISA !! La oferta del Día de la Tierra finalizará pronto,... y tu Cupón se acabará 😱,☄️☄️ PRESSA !! A promoção do Dia da Terra acabará em breve,... e seu cupom vai acabar 😱,☄️☄️ СПЕШИТЕ !! Скоро заканчивается распродажа в честь Дня Земли,... и ваш купон закончится 😱,☄️☄️ ПОСПІШАЙТЕ!! Розпродаж до Дня Землі незабаром закінчиться,...і ваш купон закінчиться 😱,☄️☄️ Eile!! Der Earth Day Sale endet bald,...und dein Coupon läuft aus 😱,️☄️ VITE !! La vente du Jour de la Terre se termine bientôt,... et votre coupon sera épuisé 😱,️☄️ CEPAT!! Obral Hari Bumi Segera Berakhir,...dan Kupon Anda akan habis 😱,☄️☄️ 서둘러!! 지구의 날 할인이 곧 종료됩니다,...쿠폰이 소진됩니다 😱,☄️☄️ NHANH LÊN !! Giảm giá Ngày Trái đất sắp kết thúc,... và tất cả Coupon sẽ hết 😱,☄️☄️HURRY!! アースデイセールは間もなく終了します,...そしてあなたのクーポンはなくなります😱,☄️☄️ AFFRETTATEVI!! I saldi per la Giornata della Terra stanno per terminare,...e il tuo Coupon scadrà 😱,☄️☄️ जल्दी करो !! पृथ्वी दिवस की बिक्री जल्द समाप्त होने वाली है,...और आपका कूपन खत्म हो जाएगा 😱,☄️☄️เร็วเข้า!! งานลดราคาวันคุ้มครองโลกกำลังจะสิ้นสุดในเร็วๆ นี้,...และคูปองทั้งหมดจะหมด 😱,☄️☄️ CEPAT!! Jualan Hari Bumi Akan Berakhir Tidak Lama Lagi,...dan semua Kupon akan habis 😱,☄️☄️ عجلوا !! سينتهي بيع يوم الأرض قريبًا,... وستنفد جميع القسائم 😱
5,4,50%,Flash Sale 5:5,9h,🔥HOT🔥 Flash Sale 5.5 -50%,Discount -50% For The Fastest! 👉,🔥HOT🔥 Venta Flash 5.5 -50%,¡Descuento -50% para los más rápidos! 👉,"🔥HOT🔥 Venda Flash 5,5 -50%",Desconto de -50% para os mais rápidos! 👉,Флэш-распродажа 🔥HOT 5.5 -50%,Скидка -50% на самый быстрый! 👉,"🔥ГОРЯЧЕ🔥 Флеш-розпродаж 5,5 -50%",Знижка -50% для найшвидшого! 👉,🔥HOT Flash Sale 5.5 -50%,Rabatt -50% für den Schnellsten! 👉,🔥HOT🔥 Vente Flash 5.5 -50%,Remise -50% pour le plus rapide ! 👉,HOT🔥 Flash Sale 5.5 -50%,Diskon -50% Untuk Yang Tercepat! 👉,🔥HOT🔥 플래시 세일 5.5~50%,가장 빠른 경우 -50% 할인! 👉,🔥HOT🔥 Flash Sale 5.5 -50%,Giảm -50% cho người nhanh nhất! 👉,🔥HOT🔥フラッシュセール5.5-50％,最速の人のための割引-50％！ 👉,"Vendita flash HOT🔥 5,5 -50%",Sconto -50% per la persona più veloce! 👉,HOT🔥 फ्लैश सेल 5.5 -50%,सबसे तेज़ व्यक्ति के लिए छूट -50%! 👉,🔥HOT🔥 ลดกระหน่ำ 5.5 -50%,ส่วนลด -50% สำหรับคนที่เร็วที่สุด! 👉,🔥HOT🔥 Jualan Kilat 5.5 -50%,Diskaun -50% Untuk Orang Terpantas! 👉,HOT🔥 تخفيضات فلاش 5.5 -50٪,خصم -50٪ لأسرع شخص! 👉
5,4,50%,Flash Sale 5:6,15h,🏆 BEST Offer in May 🏆,Tap here to receive the -50% Voucher 💢,🏆 MEJOR Oferta en mayo 🏆,Toque aquí para recibir el cupón -50% 💢,🏆 MELHOR oferta em maio 🏆,Toque aqui para receber o voucher de -50% 💢,🏆 ЛУЧШЕЕ предложение в мае 🏆,"Нажмите здесь, чтобы получить купон -50% 💢",🏆 НАЙКРАЩА пропозиція у травні 🏆,"Торкніться тут, щоб отримати ваучер на -50% 💢",🏆 BESTES Angebot im Mai 🏆,"Tippe hier, um den -50% Gutschein zu erhalten 💢",MEILLEURE offre en mai 🏆,Appuyez ici pour recevoir le bon de -50% 💢,🏆 Penawaran TERBAIK di bulan Mei 🏆,Ketuk di sini untuk menerima -50% Voucher 💢,🏆 5월 최고의 혜택 🏆,-50% 바우처를 받으려면 여기를 누르세요 💢,🏆 Ưu đãi HỜI NHẤT tháng 5 🏆,Nhấn vào đây để nhận Voucher -50% 💢,🏆5月のベストオファー🏆,-50％のバウチャーを受け取るには、ここをクリックしてください💢,🏆 MIGLIORE Offerta di Maggio 🏆,Tocca qui per ricevere il Buono -50% 💢,🏆 मई में बेस्ट ऑफर 🏆,-50% वाउचर प्राप्त करने के लिए यहां टैप करें 💢,🏆 ข้อเสนอที่ดีที่สุดในเดือนพฤษภาคม 🏆,แตะที่นี่เพื่อรับเวาเชอร์ -50% 💢,🏆 Tawaran TERBAIK pada bulan Mei 🏆,Ketik di sini untuk menerima Baucar -50% 💢,🏆 أفضل عرض مايو 🏆,انقر هنا للحصول على قسيمة بنسبة 50٪ 💢
5,4,50%,Flash Sale 5:7,20h,💥DISCOUNT for First 100 People💥,Will you be the fastest one? 😉,💥 DESCUENTO para las primeras 100 personas💥,¿Serás el más rápido? 😉,💥DISCOUNT for First 100 People💥,Você vai ser o mais rápido? 😉,💥СКИДКА на первые 100 человек💥,Вы будете самым быстрым? 😉,💥ЗНИЖКА для перших 100 людей💥,Ти будеш найшвидшим? 😉,💥RABATT für die ersten 100 Personen💥,Wirst du der Schnellste sein? 😉,💥RÉDUCTION pour les 100 premières personnes💥,Serez-vous le plus rapide ? 👉,DISKON untuk 100 Orang Pertama💥,Apakah Anda akan menjadi yang tercepat? 😉,💥선착순 100명 할인💥,당신은 가장 빠른 것입니까? 😉,💥 GIẢM GIÁ cho 100 người đầu tiên💥,Bạn sẽ là người nhanh nhất? 😉,💥最初の100人の割引💥,あなたは最速になりますか？ 😉,💥SCONTO per le prime 100 persone💥,Sarai il più veloce? 😉,💥पहले 100 लोगों के लिए छूट💥,क्या आप सबसे तेज़ होंगे? 😉,💥ส่วนลดสำหรับ 100 ท่านแรก💥,คุณจะเป็นคนที่เร็วที่สุด? 😉,💥DISKAUN untuk 100 Orang Terawal💥,Adakah anda akan menjadi yang terpantas? 😉,💥 الخصم لأول 100 شخص,هل ستكون الأسرع؟ 😉
5,5,50%,Flash Sale 5:8,9h,🔥 ONLY chance to discount -50% 🔥,✔️Check the coupons now,🔥 ÚNICA posibilidad de descuento -50% 🔥,✔️Consulte los cupones ahora,🔥 SÓ chance de desconto de -50% 🔥,✔️ Verifique os cupons agora,🔥 ТОЛЬКО шанс на скидку -50% 🔥,✔️Проверьте купоны сейчас,🔥 ТІЛЬКИ можливість на знижку -50% 🔥,✔️Перегляньте купони зараз,🔥 NUR Chance auf Rabatt -50% 🔥,✔️Jetzt Gutscheine checken,🔥 SEULE chance de remise -50% 🔥,✔️Consultez les coupons maintenant,🔥 HANYA kesempatan untuk diskon -50% 🔥,✔️ ️Periksa kupon sekarang,🔥 -50%만 할인받을 수 있는 기회 🔥,✔️쿠폰을 지금 확인하세요,🔥 Cơ hội DUY NHẤT để giảm giá -50% 🔥,✔️Kiểm tra phiếu giảm giá ngay,🔥-50％割引する唯一のチャンス🔥,✔️今すぐクーポンを確認してください,🔥 SOLO possibilità di sconto -50% 🔥,✔️Controlla subito i coupon,केवल छूट का मौका -50% 🔥,✔️ अभी कूपन जांचें,🔥 โอกาสเดียวลด -50% 🔥,✔️ตรวจสอบคูปองทันที,🔥 SAHAJA peluang diskaun -50% 🔥,✔️Semak kupon sekarang,🔥 فرصة فقط للخصم -50٪,✔️ تحقق من القسائم الآن
5,5,50%,Flash Sale 5:9,15h,🔥 SALE OFF -50% 🔥,Hurry Up to Grab the DEAL 👉,🔥 VENTA DE -50% 🔥,Date prisa para conseguir la OFERTA 👉,🔥 VENDA OFF -50% 🔥,Apresse-se para pegar o NEGÓCIO 👉,🔥 СКИДКА -50% 🔥,Спешите получить СДЕЛКУ 👉,🔥 ЗНИЖКА -50% 🔥,Поспішайте отримати АКЦІЮ 👉,🔥 AUSVERKAUF -50% 🔥,"Beeilen Sie sich, um den DEAL zu sichern 👉",VENTE OFFERTE -50% 🔥,Dépêchez-vous de saisir le DEAL 👉,DISKON PENJUALAN -50% 🔥,Buruan Dapatkan DEALnya 👉,🔥 세일 -50% 🔥,서둘러서 특가를 잡으세요 👉,🔥 GIẢM GIÁ -50% 🔥,Nhanh tay để nhận DEAL nào 👉,🔥セールオフ-50％🔥,お急ぎください👉,🔥 SCONTO -50% 🔥,Affrettati ad aggiudicarti l'AFFARE 👉,🔥 बिक्री बंद -50% 🔥,डील हथियाने के लिए जल्दी करें 👉,🔥 ลดราคา -50% 🔥,รีบคว้าข้อตกลง 👉,🔥 JUALAN DISKAUN -50% 🔥,Cepat Rebut TAWARAN 👉,🔥 تخفيضات البيع -50٪ 🔥,سارع للاستيلاء على الصفقة 👉
5,5,50%,Flash Sale 5:10,20h,OOPS! Flash Sale 5:5 Ending Soon 😱😱,DON'T MISS IT 👉,"¡Oh, no! Venta flash 5: 5 terminando pronto 😱😱",NO TE LO PIERDAS 👉,Oh não! Venda instantânea 5: 5 acabando em breve 😱😱,NÃO PERCA 👉,"О, нет! Флэш-распродажа 5: 5 скоро закончится 😱😱",НЕ ПРОПУСТИТЕ 👉,О ні! Flash Sale 5:5 Незабаром закінчиться 😱😱,НЕ ПРОПУСТІТЬ 👉,Ach nein! Flash Sale 5:5 endet bald 😱😱,NICHT VERPASSEN 👉,Oh non! Vente Flash 5:5 se terminant bientôt 😱😱,A NE PAS MANQUER 👉,Oh tidak! Flash Sale 5:5 Segera Berakhir,JANGAN LEWATKAN 👉,안 돼! 5:5 플래시 세일이 곧 종료됩니다 😱😱,놓치지 마세요 👉,Ôi không! Flash Sale 5:5 Sắp kết thúc 😱😱,ĐỪNG BỎ LỠ 👉,大野！ フラッシュセール5：5間もなく終了😱😱,お見逃しなく👉,Oh no! Vendita flash 5:5 che sta per finire 😱😱,DA NON PERDERE 👉,नहीं ओ! फ्लैश सेल 5:5 जल्द खत्म हो रही है 😱😱,इसे मिस न करें 👉,ไม่นะ! Flash Sale 5:5 กำลังจะสิ้นสุดเร็วๆ นี้ 😱😱,ห้ามพลาด 👉,Oh tidak! Jualan Kilat 5:5 Akan Berakhir Tidak Lama Lagi 😱😱,JANGAN LEPASKAN 👉,أوه لا! بيع فلاش 5: 5 سينتهي قريبًا 😱😱,لا تفوتها 👉
5,31,30%,Goodbye May!,9h,🔔 Goodbye May! Super Sale 🔔,100 GIFT VOUCHER for the fastest 👉,🔔 ¡Adiós May! Super Venta 🔔,BONO REGALO 100 para el más rápido 👉,🔔 Adeus Maio! Super venda 🔔,100 GIFT VOUCHER para o mais rápido 👉,"🔔 Прощай, май! Супер распродажа 🔔",100 ПОДАРОЧНЫЙ ВАУЧЕР для самых быстрых 👉,"🔔 До побачення, травень! Супер розпродаж 🔔",100 ПОДАРУНКОВИЙ ВАУЧЕР для найшвидшого 👉,🔔 Auf Wiedersehen Mai! Supersale 🔔,100 GESCHENKGUTSCHEIN für die Schnellsten 👉,🔔 Au revoir Mai ! Super vente 🔔,100 BON CADEAU pour les plus rapides 👉,🔔 Selamat tinggal Mei! Super Sale 🔔,100 HADIAH VOUCHER untuk yang tercepat 👉,🔔 굿바이 5월! 슈퍼세일 🔔,가장 빠른 100기프트 바우처 👉,🔔 Siêu GIẢM GIÁ tạm biệt tháng 5 🔔,100 VOUCHER cho người nhanh nhất 👉,🔔さようなら5月！ スーパーセール🔔,最速の100ギフトバウチャー👉,🔔 Arrivederci maggio! SUPER VENDITA 🔔,100 BUONI REGALO per il più veloce 👉,🔔 अलविदा मई! सुपर सेल 🔔,सबसे तेज़ . के लिए 100 उपहार वाउचर 👉,🔔 ลาก่อนพฤษภาคม! ซุปเปอร์เซล 🔔,100 VOUCHER เร็วที่สุด 👉,🔔 Selamat tinggal Mei! Diskaun Super 🔔,100 GIFT VOUCHER untuk yang terpantas 👉,🔔 وداعا ماي! خصم سوبر,100 قسيمة هدايا لأسرع 👉
5,31,30%,Goodbye May!,15h,🎉 Goodbye May! 🎉 100 COUPONS -30% FOR YOU,💌 You are invited. Join our party now!,🎉 ¡Adiós May! 🎉 100 CUPONES -30% PARA TI,💌 Estás invitado. ¡Únete a nuestra fiesta ahora!,🎉 Adeus Maio! 🎉 100 CUPONS -30% PARA VOCÊ,💌 Você está convidado. Junte-se à nossa festa agora!,"🎉 Прощай, май! 🎉 100 КУПОНОВ -30% ДЛЯ ВАС",💌 Вы приглашены. Присоединяйтесь к нашей вечеринке прямо сейчас!,"🎉 До побачення, травень! 🎉 100 КУПОНОВ -30%",💌 Запрошуємо. Приєднуйтесь до нашої вечірки зараз!,🎉 Auf Wiedersehen Mai! 🎉 100 GUTSCHEINE -30%,💌 Sie sind eingeladen. Mach jetzt mit bei unserer Party!,🎉Au revoir Mai ! 🎉100 COUPONS -30%,💌 Vous êtes invité. Rejoignez notre fête maintenant!,🎉Selamat tinggal🎉 Mei! 100 KUPON -30%,💌 Anda diundang. Bergabunglah dengan pesta kami sekarang!,🎉 굿바이 5월! 🎉 100쿠폰 -30%,💌 여러분을 초대합니다. 지금 우리 파티에 참여하세요!,🎉 Tạm biệt tháng 5! 🎉 100 mã giảm 30%,💌 Bạn đã được mời. Tham gia ngay thôi!,🎉さようなら5月！ 🎉100クーポン-30％,💌あなたは招待されました。 今すぐパーティーに参加してください！,🎉 Arrivederci maggio! 🎉 100 BUONI -30%,💌 Sei stato invitato. Unisciti subito alla nostra festa!,🎉 अलविदा मई! 🎉100 कूपन -30%,💌 आपको आमंत्रित किया गया था। अभी हमारी पार्टी में शामिल हों!,🎉 ลาก่อนเดือนพฤษภาคม! 🎉 100 คูปอง -30%,💌เรียนเชิญค่ะ เข้าร่วมปาร์ตี้ของเราตอนนี้!,🎉 Selamat tinggal Mei! 🎉 100 KUPON -30%,💌 Anda dijemput. Sertai parti kami sekarang!,🎉 وداعا ماي! 🎉 100 كوبونات -30٪,💌 أنت مدعو. انضم إلى حفلتنا الآن!
5,31,30%,Goodbye May!,20h,💥[HOT] Special offer for last May's day💥 ,Hurry Up! Flash Sale ending soon 👉,💥 [CALIENTE] Oferta especial -30%💥,¡Darse prisa! Venta flash que terminará pronto 👉,💥 [QUENTE] Oferta especial para Maio💥,Se apresse! Promoção relâmpago terminando em breve 👉,💥 [HOT] Специальное предложение -30% 💥,Торопиться! Флэш-распродажа скоро закончится 👉,💥[HOT] Спеціальна пропозиція -30%💥,Поспішай! Флеш-розпродаж незабаром закінчиться 👉,💥[HOT] Sonderangebot für den letzten Maitag💥,Beeil dich! Flash Sale endet bald 👉,💥[HOT] Offre spéciale -30%💥,Dépêchez-vous! La vente flash se termine bientôt 👉,💥[HOT] Penawaran khusus -30%💥,Percepat! Flash Sale akan segera berakhir 👉,💥[HOT] 특별할인 -30%💥,서둘러 요! 플래시세일 종료 👉,💥 [HOT] Ưu đãi đặc biệt cuối tháng -30%💥,Nhanh lên! Flash Sale sắp kết thúc 👉,💥[HOT]特別オファー-30％💥,急げ！ フラッシュセールはまもなく終了します👉,💥[HOT] Offerta speciale -30%💥,Affrettarsi! La vendita flash sta per terminare 👉,💥[हॉट] विशेष पेशकश -30%💥,जल्दी से! फ्लैश सेल जल्द खत्म हो रही है 👉,💥[HOT] ข้อเสนอพิเศษ -30%💥,รีบขึ้น! Flash Sale ใกล้หมดเขตแล้ว 👉,💥[HOT] Tawaran istimewa -30%💥,Cepat! Jualan Kilat akan tamat tidak lama lagi 👉,💥 [HOT] عرض خاص -30٪ 💥,عجلوا! بيع الفلاش سينتهي قريبًا 👉
6,6,50%,Flash Sale 6:6 ,9h,📢 ONLY 1 DAY - SALE 50% in 6/6 📢 ,Open to catch your Flash Sale👉,📢 SOLO 1 DÍA - VENTA 50% en 6/6 📢,Abra para atrapar su Venta Flash👉,📢 APENAS 1 DIA - VENDA 50% em 6/6 📢,Aberto para pegar sua venda relâmpago👉,📢 ТОЛЬКО 1 ДЕНЬ - СКИДКА 50% через 6/6 📢,"Откройте, чтобы поймать вашу флеш-распродажу👉",📢 ТІЛЬКИ 1 ДЕНЬ - РОЗПРОДАЖ 50% через 6/6 📢,"Відкрийте, щоб побачити свій Flash-розпродаж👉",📢 NUR 1 TAG - SALE 50% im 6/6 📢,"Öffnen Sie, um Ihren Flash-Sale zu fangen👉",📢 SEULEMENT 1 JOUR - VENTE 50% en 6/6 📢,Ouvrez pour saisir votre Vente Flash👉,📢 HANYA 1 HARI - SALE 50% di 6/6 📢 ,Buka untuk mendapatkan Flash Sale Anda 👉,📢 단 하루 - 6/6에 50% 세일 📢,귀하의 플래시 세일을 잡으려면 엽니다👉,📢 CHỈ 1 NGÀY - SALE 50% 6/6 📢,Mở để đón Flash Sale nào 👉,📢たった1日-セール50％6 /6📢,アプリを開いてフラッシュセールをキャッチ👉,📢 SOLO 1 GIORNO - SCONTO 50% 6/6 📢,Apri l'app per catturare la tua vendita flash👉,📢 केवल 1 दिन - 6/6 में 50% बिक्री,अपनी फ्लैश सेल को पकड़ने के लिए खुला 👉 ,📢 1 วันเท่านั้น - SALE 50% ใน 6/6 📢,เปิดรับ Flash Sale 👉,📢 HANYA 1 HARI - JUALAN 50% dalam 6/6 📢,Terbuka untuk mendapatkan Jualan Kilat anda👉,📢 يوم واحد فقط - تخفيضات 50٪ في 6/6,افتح للقبض على تنزيلات الفلاش الخاصة بك👉
6,6,50%,Flash Sale 6:7,15h,🔥🔥 SALE OFF -50% 🔥🔥 Don't miss the chance!                       ,Hurry Up to Grab the DEAL 👉,🔥🔥 OFERTA -50% 🔥🔥 ¡No pierdas la oportunidad!,Date prisa para conseguir la OFERTA 👉,🔥🔥 VENDA OFF -50% 🔥🔥 Não perca a chance!,Apresse-se para pegar o NEGÓCIO 👉,🔥🔥 СКИДКА -50% 🔥🔥 Не упустите шанс!,Спешите получить СДЕЛКУ 👉,🔥🔥 ЗНИЖКА -50% 🔥🔥 Не пропустіть свій шанс!,Поспішайте отримати АКЦІЮ 👉,🔥🔥 SALE OFF -50% 🔥🔥 Verpasse nicht die Chance!,"Beeilen Sie sich, um den DEAL zu sichern 👉",🔥🔥 PROMOTION -50% 🔥🔥 Ne manquez pas l'occasion !,Dépêchez-vous de saisir le DEAL 👉,🔥🔥 SALE OFF -50% 🔥🔥 Jangan lewatkan kesempatan ini!,Buruan Dapatkan DEALnya 👉,🔥🔥 SALE OFF -50% 🔥🔥 기회를 놓치지 마세요!,서둘러서 특가를 잡으세요 👉,🔥🔥 SALE OFF -50% 🔥🔥 Đừng bỏ lỡ cơ hội này!,Nhanh tay nhận DEAL 👉,🔥🔥セールオフ-50％🔥🔥チャンスをお見逃しなく！,お急ぎください👉,🔥🔥 SCONTO -50% 🔥🔥 Non perdere l'occasione!,Affrettati ad aggiudicarti l'AFFARE 👉,बिक्री बंद -50% 🔥🔥 मौका न चूकें!,डील हथियाने के लिए जल्दी करें 👉,🔥🔥 SALE OFF -50% 🔥🔥 อย่าพลาดโอกาส!,รีบคว้าข้อตกลง 👉,🔥🔥 SALE OFF -50% 🔥🔥 Jangan lepaskan peluang!,Cepat Rebut TAWARAN 👉,🔥🔥 خصم 50٪ لا تفوت الفرصة!,سارع للاستيلاء على الصفقة 👉
6,6,50%,Flash Sale 6:8,20h,OOPS! Flash Sale ending soon 😱😱,Tap here to receive the -50% Voucher 💢,"¡Oh, no! Venta flash que terminará pronto 😱😱",Toque aquí para recibir el cupón -50% 💢,Oh não! Promoção relâmpago terminando em breve 😱😱,Toque aqui para receber o voucher de -50% 💢,"О, нет! Флэш-распродажа скоро закончится 😱😱","Нажмите здесь, чтобы получить купон -50% 💢",О ні! Флеш-розпродаж незабаром закінчиться 😱😱,"Торкніться тут, щоб отримати ваучер на -50% 💢",Ach nein! Flash Sale endet bald 😱😱,"Tippe hier, um den -50% Gutschein zu erhalten 💢",Oh non! La vente flash se termine bientôt 😱😱,Appuyez ici pour recevoir le bon de -50% 💢,Oh tidak! Flash Sale akan segera berakhir 😱😱 ,Ketuk di sini untuk menerima -50% Voucher 💢,안 돼! 플래시 세일이 곧 종료됩니다 😱😱,-50% 바우처를 받으려면 여기를 누르세요 💢,Ôi bạn ơi! Flash Sale sắp kết thúc 😱😱,Nhấn vào đây để nhận Voucher -50% 💢,大野！ フラッシュセールはまもなく終了します😱😱,-50％のバウチャーを受け取るには、ここをクリックしてください💢,Oh no! La vendita flash sta per terminare 😱😱,Tocca qui per ricevere il Buono -50% 💢,नहीं ओ! फ्लैश सेल जल्द खत्म हो रही है,-50% वाउचर प्राप्त करने के लिए यहां टैप करें 💢,ไม่นะ! Flash Sale ใกล้หมดเขตแล้ว 😱😱,แตะที่นี่เพื่อรับเวาเชอร์ -50% 💢,Oh tidak! Flash Sale akan tamat tidak lama lagi 😱😱,Ketik di sini untuk menerima Baucar -50% 💢,أوه لا! بيع الفلاش سينتهي قريبًا 😱😱,انقر هنا للحصول على قسيمة بنسبة 50٪ 💢
