,,,,,US-en,US-en,MX-es,MX-es,BR-pt,BR-pt,RU-ru,RU-ru,UK-uk,UK-uk,DE-de,DE-de,FR-fr,FR-fr,ID-id,ID-id,KR-ko,KR-ko,VN-vi,VN-vi,JP-ja,JP-ja,IT-it,IT-it,IN-hi,IN-hi,TH-th,TH-th,MS-ms,MS-ms,UAE-ar,UAE-ar
9,29,30%,Goodbye September!,9h,😱 29 COUPONS LEFT 😱,Will you receive it in time? 🕛,😱 SOLO 29 CUPONES,¿Lo conseguirás a tiempo? 🕛,😱 APENAS 29 CUPONS,Você vai conseguir a tempo? 🕛,😱 ТОЛЬКО 29 КУПОНОВ,Вы получите его вовремя? 🕛,😱 ЛИШЕ 29 КУПОНОВ,Ви отримаєте це вчасно? 🕛,😱 NUR 29 GUTSCHEINE,Schaffst du es rechtzeitig? 🕛,😱 SEULEMENT 29 COUPONS 😱,L'obtiendrez-vous à temps ? 🕛,😱 HANYA 29 KUPON 😱,Apakah Anda akan mendapatkannya tepat waktu? 🕛,😱 단 29개의 쿠폰,당신은 시간에 그것을 얻을 것인가? 🕛,😱 CHỈ CÒN 29 COUPONS 😱,Bạn sẽ nhận nó kịp lúc chứ? 🕛,😱29クーポン左😱,時間内に受け取りますか？ 🕛,😱 29 BUONI RIMASTI 😱,Lo riceverai in tempo? 🕛,😱 29 कूपन बचे,क्या आप इसे समय पर प्राप्त करेंगे? 🕛,😱 เหลือคูปอง 29 ใบ 😱,คุณจะได้รับมันในเวลา? 🕛,😱 TINGGAL 29 KUPON 😱,Adakah anda akan menerimanya tepat pada masanya? 🕛,😱 بقي 29 كوبون,هل ستستلمها في الوقت المناسب؟ 🕛
9,29,30%,Goodbye September!,15h,🔔 DON'T FORGET to receive your coupon,17 COUPONS LEFT 😱,🔔 NO OLVIDE recibir su cupón,SOLO 17 CUPONES 😱,🔔 NÃO SE ESQUEÇA de receber seu cupom,APENAS 17 CUPONS 😱,🔔 НЕ ЗАБУДЬТЕ получить купон,ТОЛЬКО 17 КУПОНОВ 😱,🔔 НЕ ЗАБУДЬТЕ отримати свій купон,ЛИШЕ 17 КУПОНОВ 😱,"🔔 VERGESSEN SIE NICHT, Ihren Gutschein zu erhalten",NUR 17 GUTSCHEINE 😱,🔔 N'OUBLIEZ PAS de recevoir votre coupon,SEULEMENT 17 COUPONS 😱,🔔 JANGAN LUPA untuk menerima kupon Anda,HANYA 17 KUPON 😱,🔔 잊지말고 쿠폰 받아가세요,단 17개의 쿠폰 😱,🔔 ĐỪNG QUÊN nhận phiếu giảm giá của bạn,CHỈ CÒN 17 COUPONS 😱,🔔クーポンを受け取るのを忘れないでください,17クーポン左😱,🔔 NON DIMENTICARE di ricevere il tuo coupon,17 BUONI RIMASTI 😱,🔔 अपना कूपन प्राप्त करना न भूलें,17 कूपन बचे 😱,🔔อย่าลืมรับคูปอง,เหลือ 17 คูปอง 😱,🔔 JANGAN LUPA terima kupon anda,TINGGAL 17 KUPON 😱,🔔 لا تنسى استلام قسيمتك,17 كوبونات متبقية 😱
9,29,30%,Goodbye September!,20h,🕛 HURRY! The Sale Day ending soon!,DON'T MISS IT 👉,🕛 ¡RÁPIDO! ¡El día de la venta terminará pronto!,NO TE LO PIERDAS 👉,🕛 RÁPIDO! O Dia de Venda acabará em breve!,NÃO PERCA 👉,🕛 БЫСТРО! Скоро заканчивается распродажа!,НЕ ПРОПУСТИТЕ 👉,🕛 ШВИДКО! День розпродажу незабаром закінчиться!,НЕ ПРОПУСТІТЬ 👉,🕛 SCHNELL AUF! Der Sale Day endet bald!,NICHT VERPASSEN 👉,🕛 RAPIDEMENT ! Le jour de la vente se termine bientôt !,A NE PAS MANQUER 👉,🕛 CEPAT! Hari Penjualan akan segera berakhir!,JANGAN LEWATKAN 👉,🕛 서두르세요! 세일데이가 곧 종료됩니다!,놓치지 마세요 👉,🕛 NHANH LÊN! Ngày giảm giá sắp kết thúc!,ĐỪNG BỎ LỠ 👉,🕛ハリー！ セールデーはもうすぐ終わります！,お見逃しなく👉,🕛 AFFRETTATI! Il giorno dei saldi sta finendo!,DA NON PERDERE 👉,🕛 जल्दी करो! बिक्री दिवस जल्द ही समाप्त हो रहा है!,इसे मिस न करें 👉,🕛 เร็วเข้า! วันขายจะสิ้นสุดลงในไม่ช้า!,ห้ามพลาด 👉,🕛 CEPAT! Hari Jualan akan berakhir tidak lama lagi!,JANGAN LEPASKAN 👉,🕛 عجل! ينتهي يوم التخفيضات قريبًا!,لا تفوتها 👉
9,30,30%,Goodbye September!,9h,❌ YOU HAVE ONE LAST CHANCE!!!,📅 Today is the last day to get your COUPON,❌ ¡¡¡TIENES UNA ÚLTIMA OPORTUNIDAD !!!,📅 Hoy es el último día para obtener su CUPÓN,❌ VOCÊ TEM UMA ÚLTIMA OPORTUNIDADE !!!,📅 Hoje é o último dia para receber seu CUPOM,❌ У ВАС ЕСТЬ ОДИН ПОСЛЕДНИЙ ШАНС !!!,"📅 Сегодня последний день, когда можно получить КУПОН",❌ У ВАС Є ОСТАННІЙ ШАНС!!!,"📅 Сьогодні останній день, щоб отримати КУПОН",❌ DU HAST EINE LETZTE CHANCE!!!,"📅 Heute ist der letzte Tag, um deinen GUTSCHEIN zu erhalten",❌VOUS AVEZ UNE DERNIÈRE CHANCE !!!,📅 Aujourd'hui est le dernier jour pour obtenir votre COUPON,❌ ANDA MEMILIKI SATU KESEMPATAN TERAKHIR!!!,📅 Hari ini adalah hari terakhir untuk mendapatkan KUPON your,❌ 마지막 기회가 있습니다!!!,📅 오늘이 쿠폰을 받을 수 있는 마지막 날입니다.,❌ BẠN CÓ MỘT CƠ HỘI CUỐI CÙNG !!!,📅 Hôm nay là ngày cuối để nhận PHIẾU GIẢM GIÁ của bạn,❌最後のチャンスが1つあります!!!,📅今日はあなたのクーポンを取得する最後の日です,❌ HAI UN'ULTIMA POSSIBILITA'!!!,📅 Oggi è l'ultimo giorno per ricevere il tuo COUPON,❌ आपके पास एक आखिरी मौका है!!!,📅 आपका कूपन प्राप्त करने का आज अंतिम दिन है,❌ โอกาสสุดท้ายแล้ว !!!,📅 วันนี้วันสุดท้ายที่จะได้รับ COUPON,❌ ANDA ADA SATU PELUANG TERAKHIR!!!,📅 Hari ini adalah hari terakhir untuk mendapatkan KUPON,❌ لديك فرصة أخيرة !!!,📅 اليوم هو آخر يوم تحصل فيه على القسيمة
9,30,30%,Goodbye September!,15h,The Last Day To Get Your Gift 😱😱,Hurry Up to Grab the DEAL 👉,El último día para recibir tu regalo 😱😱,Date prisa para conseguir la OFERTA 👉,O último dia para receber seu presente 😱😱,Apresse-se para pegar o NEGÓCIO 👉,Последний день для получения подарка 😱😱,Спешите получить СДЕЛКУ 👉,"Останній день, щоб отримати подарунок 😱😱",Поспішайте отримати АКЦІЮ 👉,"Der letzte Tag, um Ihr Geschenk zu bekommen 😱😱","Beeilen Sie sich, um den DEAL zu sichern 👉",Le dernier jour pour recevoir votre cadeau 😱😱,Dépêchez-vous de saisir le DEAL 👉,Hari Terakhir Untuk Mendapatkan Hadiah Anda 😱😱,Buruan Dapatkan DEALnya 👉,선물을 받을 수 있는 마지막 날 😱😱,서둘러서 특가를 잡으세요 👉,Ngày cuối cùng để nhận quà của bạn 😱😱,Nhanh tay nhận ngay 👉,贈り物をもらう最後の日😱😱,お急ぎください👉,L'ultimo giorno per ricevere il tuo regalo 😱😱,Affrettati ad aggiudicarti l'AFFARE 👉,अपना उपहार प्राप्त करने का अंतिम दिन 😱😱,डील हथियाने के लिए जल्दी करें 👉,วันสุดท้ายในการรับของขวัญ 😱😱,รีบคว้าข้อตกลง 👉,Hari Terakhir Untuk Mendapat Hadiah Anda 😱😱,Cepat Rebut TAWARAN 👉,آخر يوم للحصول على هديتك 😱😱,سارع للاستيلاء على الصفقة 👉
9,30,30%,Goodbye September!,20h,💥September Sale ending in hours 😱😱,Get your COUPON before it disappears 👉,💥Rebajas de septiembre terminando en horas,Obtén tu CUPÓN antes de que desaparezca 👉,💥 Liquidação de setembro terminando em horas 😱😱,Pegue seu CUPOM antes que desapareça 👉,💥Сентябрьская распродажа заканчивается через часы,"Получите свой КУПОН, пока он не исчез 👉",💥 Розпродаж у вересні закінчується через години,"Отримайте свій КУПОН, перш ніж він зник 👉",💥September Sale endet in Stunden 😱😱,"Holen Sie sich Ihren COUPON, bevor er verschwindet 👉",💥 Vente de septembre se terminant dans les heures 😱😱,Obtenez votre COUPON avant qu'il ne disparaisse 👉,💥 Penjualan September berakhir dalam hitungan jam 😱😱,Dapatkan KUPON Anda sebelum menghilang 👉,💥9월 세일 종료,사라지기 전에 쿠폰을 받으세요 👉,💥 Ưu đãi tháng 9 kết thúc sau vài giờ nữa 😱😱,Nhận COUPON của bạn trước khi nó biến mất 👉,💥9月のセールは数時間で終了します😱😱,それが消える前にあなたのクーポンを入手してください👉,💥Saldi di settembre che terminano tra poche ore 😱😱,Ottieni il tuo COUPON prima che scompaia 👉,सितंबर बिक्री घंटों में समाप्त हो रही है 😱😱,अपना कूपन गायब होने से पहले प्राप्त करें 👉,💥September Sale จะสิ้นสุดในอีกไม่กี่ชั่วโมง 😱😱,รับคูปองก่อนมันจะหายไป 👉,💥September Sale berakhir dalam beberapa jam 😱😱,Dapatkan KUPON anda sebelum ia hilang 👉,تخفيضات سبتمبر تنتهي بساعات 😱😱,احصل على القسيمة الخاصة بك قبل أن تختفي 👉
10,10,50%,Flash Sale 10:10,9h,📢 FLASH SALE 📢 Happy 10.10!,Discount -50% For The Fastest! 👉,📢 OFERTA FLASH 📢 ¡Feliz 10.10!,¡Descuento -50% para los más rápidos! 👉,📢 VENDA FLASH 📢 Feliz 10.10!,Desconto de -50% para os mais rápidos! 👉,📢 FLASH SALE 📢 Happy 10.10!,Скидка -50% на самый быстрый! 👉,📢 ФЛЕШ-РАСПРОДАЖ 📢 З 10.10!,Знижка -50% для найшвидшого! 👉,📢 FLASH SALE 📢 Happy 10.10!,Rabatt -50% für den Schnellsten! 👉,📢 VENTE FLASH 📢 Joyeux 10.10 !,Remise -50% pour le plus rapide ! 👉,📢 FLASH SALE 📢 Selamat 10.10!,Diskon -50% Untuk Yang Tercepat! 👉,📢 플래시 세일 📢 행복한 10.10!,가장 빠른 경우 -50% 할인! 👉,📢 FLASH SALE 📢 Chúc mừng ngày 10.10!,Giảm -50% cho người nhanh nhất! 👉,📢フラッシュセール📢ハッピー10.10！,最速の人のための割引-50％！ 👉,📢 SALDI FLASH 📢 Buon 10.10!,Sconto -50% per la persona più veloce! 👉,📢 फ्लैश सेल 10.10 📢 की शुभकामनाएं!,सबसे तेज़ व्यक्ति के लिए छूट -50%! 👉,📢 FLASH SALE 📢 สุขสันต์ 10.10 น.!,ส่วนลด -50% สำหรับคนที่เร็วที่สุด! 👉,📢 FLASH SALE 📢 Selamat 10.10!,Diskaun -50% Untuk Orang Terpantas! 👉,📢 تنزيلات فلاش 📢 سعيد 10.10!,خصم -50٪ لأسرع شخص! 👉
10,10,50%,Flash Sale 10:11,15h,🏷️ 100 VOUCHER -50% for the fastest 🏷️,🔥 Will you be the winner? ,🏷️ 100 VOUCHER -50% para la persona más rápida 🏷️,🔥 ¿Serás el ganador?,🏷️ 100 VOUCHER -50% para a pessoa mais rápida 🏷️,🔥 Você será o vencedor?,🏷️ 100 ВАУЧЕР -50% для самого быстрого 🏷️,🔥 Станете ли вы победителем?,🏷️ ВАУЧЕР 100 -50% для найшвидшої людини 🏷️,🔥 Ви станете переможцем?,🏷️ 100 GUTSCHEIN -50% für die schnellste Person 🏷️,🔥 Wirst du der Gewinner sein?,🏷️ BON DE 100 -50% pour la personne la plus rapide 🏷️,🔥 Serez-vous le gagnant ?,️🏷️ 100 VOUCHER -50% untuk orang tercepat 🏷️ ️,🔥 Apakah Anda akan menjadi pemenangnya?,🏷️ 100 바우처 - 가장 빠른 사람 50% 🏷️,🔥 승자가 되시겠습니까?,🏷️ 100 VOUCHER -50% cho người nhanh nhất 🏷️,🔥 Bạn sẽ là người chiến thắng?,🏷️100バウチャー-50％最速の人🏷️,🔥あなたが勝者になりますか？,🏷️ 100 VOUCHER -50% per la persona più veloce 🏷️,🔥 Sarai il vincitore?,🏷️ 100 वाउचर -50% सबसे तेज व्यक्ति के लिए ️,🔥 क्या आप विजेता होंगे?,🏷️ 100 VOUCHER -50% สำหรับคนเร็วที่สุด🏷️,🔥 คุณจะเป็นผู้ชนะหรือไม่?,🏷️ 100 BAUCAR -50% untuk orang terpantas 🏷️,🔥 Adakah anda akan menjadi pemenang?,🏷️ قسيمة 100 -50٪ لأسرع شخص,🔥 هل ستكون الفائز؟
10,10,50%,Flash Sale 10:12,20h,🕛 HURRY! Flash Sale ending soon ,Grab your offer now 👉,🕛 ¡PRISA! La venta flash finalizará pronto,Acepta tu oferta ahora 👉,🕛 PRESSA! Venda relâmpago terminando em breve,Pegue sua oferta agora 👉,🕛 СПЕШИТЕ! Флэш-распродажа скоро закончится,Получите свое предложение прямо сейчас 👉,🕛 ПОСПІШАЙТЕ! Flash Sale незабаром закінчиться,Скористайтеся своєю пропозицією зараз 👉,🕛 Eile! Flash Sale endet bald,Schnapp dir jetzt dein Angebot 👉,🕛 VITE ! La vente flash se termine bientôt,Saisissez votre offre maintenant 👉,🕛 CEPAT! Flash Sale akan segera berakhir,Dapatkan penawaran Anda sekarang 👉,🕛 서둘러! 플래시 판매가 곧 종료됩니다.,지금 혜택을 받아보세요 👉,🕛 NHANH NÀO! Flash Sale sắp kết thúc,Nhận ưu đãi của bạn ngay bây giờ 👉,🕛急いで！ フラッシュセールはまもなく終了します,今すぐオファーを入手してください👉,🕛 AFFRETTATI! La vendita flash sta per scadere,Approfitta subito della tua offerta 👉,🕛 जल्दी करो! फ्लैश सेल जल्द खत्म हो रही है,अपना ऑफ़र अभी प्राप्त करें 👉,🕛 ด่วน! Flash Sale จะหมดเขตเร็วๆนี้,รับข้อเสนอของคุณตอนนี้👉,🕛 CEPAT! Jualan Kilat akan tamat tidak lama lagi,Rebut tawaran anda sekarang 👉,🕛 أسرع! سينتهي بيع الفلاش قريبًا,احصل على عرضك الآن 👉
10,30,50%,Happy Halloween!,9h,💥[SHOCK]  HALLOWEEN SALE -50%💥,"Catch it, catch it NOW 👻👉",💥 [SHOCK] REBAJAS DE HALLOWEEN -50% 💥,"Cómpralo, cómpralo AHORA 👉",💥 [SHOCK] VENDA DE HALLOWEEN -50% 💥,"Pegue, pegue AGORA 👻👉",💥 [HOT] РАСПРОДАЖА НА ХЭЛЛОУИН -50% 💥,Купить сейчас 👻👉,💥[ШОК] РОЗПРОДАЖ НА ХЕЛОУІН -50%💥,Ловіть це ЗАРАЗ 👻👉,💥[SHOCK] HALLOWEEN-VERKAUF -50%💥,JETZT fangen 👻👉,💥[SHOCK] VENTE D'HALLOWEEN -50%💥,Attrapez-le maintenant 👻👉,💥 [SHOCK] HALLOWEEN SALE -50%💥,Tangkap SEKARANG 👻👉,💥[쇼크] 할로윈 세일 -50%💥,지금 바로 잡으세요 👻👉,💥 [SỐC] MỪNG HALLOWEEN SALE -50% 💥,Bắt ưu đãi NGAY 👻👉,💥[ショック]ハロウィンセール-50％💥,今すぐキャッチ👻👉,💥[SHOCK] SALDI DI HALLOWEEN -50%💥,Prendilo ORA 👻👉,💥 [झटका] हैलोवीन बिक्री -50% 💥,इसे अभी पकड़ो 👻👉,💥[ช็อค] ลดราคาฮาโลวีน -50%💥,จับเลยตอนนี้ 👻👉,💥[GEMPAR] JUALAN HALLOWEEN -50%💥,Dapatkannya SEKARANG 👻👉,💥 [صدمة] بيع الهالووين -50٪ 💥,قبض عليه الآن 👻👉
10,30,50%,Happy Halloween!,15h,💥[HOT] Mega discount. HURRY UP❗❗,🔥 Halloween price cut -50% 🔥,💥 [HOT] Mega descuento. DATE PRISA ❗❗,🔥 Halloween descuento -50% 🔥,💥 [HOT] Mega desconto. SE APRESSE❗❗,🔥 Grande promoção de Halloween -50% 🔥,💥 [HOT] Мега скидка. ТОРОПИТЬСЯ❗❗,🔥 Скидка на Хэллоуин -50% 🔥,💥[ГОРЯЧА] Мега знижка. ПОСПІШАЙТЕ❗❗,🔥 Зниження ціни на Хеллоуїн -50% 🔥,💥[HOT] Mega-Rabatt. Beeilen Sie sich❗❗,🔥 Halloween-Preissenkung -50% 🔥,💥[HOT] Mega remise. DÉPÊCHEZ-VOUS❗❗,Réduction de prix Halloween -50% 🔥,💥 [PANAS] Diskon besar. CEPAT ❗❗,🔥 Potongan harga Halloween -50% 🔥,💥[HOT] 메가 할인. 서두르세요❗❗,🔥 할로윈 가격 인하 -50% 🔥,💥 [HOT] Giảm giá cực khủng. NHANH LÊN NÀO❗❗,🔥 Halloween giảm giá -50% 🔥,💥[HOT]メガディスカウント。 急いで❗❗,🔥ハロウィーンの値下げ-50％🔥,💥[HOT] Mega sconto. AFFRETTATI❗❗,🔥 Taglio del prezzo di Halloween -50% 🔥,💥 [गर्म] मेगा छूट। जल्दी करो ❗❗,🔥 हैलोवीन कीमत में कटौती -50% 🔥,💥[HOT] ลดกระหน่ำ. รีบเลย❗❗,🔥 ลดราคาฮาโลวีน -50% 🔥,💥[HOT] Diskaun mega. CEPAT❗❗,🔥 Potongan harga Halloween -50% 🔥,💥 خصم كبير [HOT]. عجلوا,🔥 خفض سعر الهالوين -50٪
10,30,50%,Happy Halloween!,20h,🔥🔥 SALE OFF -50% 🔥🔥                        ,💣Limited time only. HURRY UP💥💥,🔥🔥 DESCUENTO -50% 🔥🔥,"💣Tiempo limitado solo, DATE PRISA💥💥",🔥🔥 LIQUIDAÇÃO -50% 🔥🔥,💣Apenas tempo limitado. APRESSE-SE💥💥,🔥🔥 СКИДКА -50% 🔥🔥,💣 Только ограниченное время. ТОРОПИТЬСЯ💥💥,🔥🔥 ЗНИЖКА -50% 🔥🔥,💣Тільки обмежений час. ПОСПІШАЙТЕ💥💥,🔥🔥 AUSVERKAUF -50% 🔥🔥,💣Nur für begrenzte Zeit. Beeilen Sie sich💥💥,VENTE OFFERTE -50% 🔥🔥,💣Durée limitée seulement. DÉPÊCHEZ-VOUS💥💥,🔥🔥 DISKON PENJUALAN -50% 🔥🔥 ,Waktu terbatas saja. CEPAT 💥💥,🔥🔥 세일 -50% 🔥🔥,💣기간 한정. 서둘러요💥💥,🔥🔥 GIẢM GIÁ -50% 🔥🔥,💣Chỉ trong thời gian giới hạn. NHANH TAY BẠN ƠI 💥💥,🔥🔥セールオフ-50％🔥🔥,💣期間限定です。 急いで💥💥,🔥🔥 SCONTO -50% 🔥🔥,💣Solo per un tempo limitato. AFFRETTATI💥💥,🔥🔥 बिक्री बंद -50% 🔥🔥,सीमित समय ही। जल्दी करो 💥💥,🔥🔥 ลดราคา -50% 🔥🔥,💣เวลาจำกัดเท่านั้น รีบเลย💥💥,🔥🔥 JUALAN DISKAUN -50% 🔥🔥,💣Masa terhad sahaja. CEPAT💥💥,🔥🔥 تخفيضات البيع -50٪ 🔥🔥,💣 الوقت المحدود فقط. عجلوا
10,31,50%,Happy Halloween!,9h,🔥[HOT] HALLOWEEN SALE 🔥,Knock down price -50% 😱😱,🔥 [HOT] REBAJAS DE HALLOWEEN 🔥,Derribar precio -50% 😱😱,🔥 [HOT] PROMOÇÃO DE HALLOWEEN 🔥,Melhor preço -50% 😱😱,🔥 [HOT] РАСПРОДАЖА НА ХЭЛЛОУИН 🔥,Цена нокдауна -50% 😱😱,🔥[ГАРЯЧИЙ] РОЗПРОДАЖ НА ХЕЛОУІН 🔥,Ціна нокдауну -50% 😱😱,🔥[HEISS] HALLOWEEN-VERKAUF 🔥,Knockdown-Preis -50% 😱😱,🔥 [HOT] VENTE D'HALLOWEEN 🔥,Prix ​​de démontage -50% 😱😱,🔥 [HOT] HALLOWEEN SALE 🔥,Harga knockdown -50% 😱😱,🔥[HOT] 할로윈 세일 🔥,넉다운 가격 -50% 😱😱,🔥 [HOT] HALLOWEEN SALE 🔥,Giá giảm thả ga -50% 😱😱,🔥[HOT]HALLOWEENSALE🔥,ノックダウン価格-50％😱😱,🔥[HOT] SALDI DI HALLOWEEN 🔥,Prezzo di abbattimento -50% 😱😱, 🔥 [गर्म] हेलोवीन बिक्री 🔥,पछाड़ना मूल्य -50% 😱😱,🔥[HOT] ลดราคาฮาโลวีน 🔥,ราคาน็อคดาวน์ -50% 😱😱,🔥[HOT] JUALAN HALLOWEEN 🔥,Harga knockdown -50% 😱😱,🔥 [HOT] بيع الهالووين 🔥,سعر الضربة القاضية -50٪
10,31,50%,Happy Halloween!,15h,💥 Halloween Sale ending soon 🎃🎃,HURRY UP 🔥🔥,💥Descuento de Halloween termina pronto 🎃🎃,¡DATE PRISA! 🔥🔥,💥 Promoção -50% termina em breve 🎃🎃,SE APRESSE 🔥🔥,💥 Супер распродажа скоро закончится 🎃🎃,ТОРОПИТЬСЯ 🔥🔥,💥 Розпродаж на Хеллоуїн незабаром закінчиться 🎃🎃,ПОСПІШАЙТЕ 🔥🔥,💥 Halloween Sale endet bald 🎃🎃,Beeil dich 🔥🔥,💥 La vente d'Halloween se termine bientôt 🎃🎃,DÉPÊCHEZ-VOUS 🔥🔥,💥 Penjualan Halloween akan segera berakhir 🎃🎃,CEPAT 🔥🔥,💥 할로윈 세일이 곧 종료됩니다 🎃🎃,서둘러 🔥🔥,💥 Ưu Đãi Halloween sắp kết thúc 🎃🎃,NHANH LÊN BẠN HIỀN 🔥🔥,💥ハロウィーンセールはまもなく終了します🎃🎃,急いで🔥🔥,💥 I saldi di Halloween stanno per terminare 🎃🎃,AFFRETTATI 🔥🔥,💥 हैलोवीन सेल जल्द खत्म होने वाली है 🎃🎃,जल्दी करो 🔥🔥,💥 ลดราคาฮาโลวีนใกล้จะสิ้นสุดแล้ว 🎃🎃,รีบเลย🔥🔥,💥 Jualan Halloween akan tamat tidak lama lagi 🎃🎃,CEPAT 🔥🔥,💥 ستنتهي تخفيضات الهالوين قريبًا,عجلوا 🔥🔥
10,31,50%,Happy Halloween!,20h,💥Halloween Sale ending in hours 😱😱,DON'T MISS IT 👻👉,💥Venta de Halloween termina en horas 😱😱,NO TE LO PIERDAS 👻👉,💥 Desconto que termina em horas 😱😱,NÃO PERCA 👻👉,💥Скидка заканчивается в часах 😱😱,НЕ ПРОПУСТИТЕ 👻👉,💥 Розпродаж на Хеллоуїн закінчується через години,НЕ ПРОПУСТІТЬ 👉,💥Halloween Sale endet in Stunden,NICHT VERPASSEN 👉,💥Vente d'Halloween se terminant dans les heures,A NE PAS MANQUER 👻👉,💥 Penjualan Halloween berakhir dalam hitungan jam,JANGAN LEWATKAN 👻👉,💥할로윈 세일이 몇 시간 후에 종료됩니다 😱😱,놓치지 마세요 👻👉,💥Ưu Đãi Halloween sẽ kết thúc sau vài giờ nữa 😱😱,ĐỪNG BỎ LỠ 👻👉,💥ハロウィーンセールは数時間で終了します😱😱,お見逃しなく👻👉,💥Saldi di Halloween che terminano tra poche ore 😱😱,DA NON PERDERE 👻👉,💥 हैलोवीन सेल घंटों में समाप्त हो रही है 😱😱,इसे मिस न करें 👻👉,💥Halloween Sale จะสิ้นสุดในอีกไม่กี่ชั่วโมง 😱😱,ห้ามพลาด 👻👉,💥Halloween Sale berakhir dalam beberapa jam 😱😱,JANGAN LEPASKAN 👻👉,💥 تخفيضات الهالوين تنتهي بساعات 😱😱,لا تفوتها 👻👉
11,11,50%,Happy Singles' Day!,9h,💥[HOT] Happy Singles Day! SALE -50%💥,"Catch it, catch it NOW 👉",💥 [HOT] ¡Feliz día de los solteros! REBAJAS -50%💥,"Cómpralo, cómpralo AHORA 👉",💥 [HOT] Feliz Dia dos Solteiros! LIQUIDAÇÃO -50% 💥,"Pegue, pegue AGORA 👉",💥 [HOT] С Днем холостяков! СКИДКА -50% 💥,Купить сейчас 👉,💥[ГОРЯЧЕ] З Днем холостяків! РОЗПРОДАЖ -50%💥,Ловіть ЗАРАЗ 👉,💥[HOT] Happy Singles Day! VERKAUF -50%💥,JETZT fangen 👉,💥[CHAUD] Bonne fête des célibataires ! SOLDE -50%💥,Attrapez-le MAINTENANT 👉,💥 [HOT] Selamat Hari Jomblo! DIJUAL -50%💥,Tangkap SEKARANG 👉,💥[HOT] 싱글들의 행복한 날! 세일 -50%💥,지금 바로 잡으세요 👉,💥 [HOT] Happy Singles Day! GIẢM GIÁ -50% 💥,Chộp ưu đãi NGAY 👉,💥[HOT]ハッピーシングルデー！ セール-50％💥,今すぐキャッチ👉,💥[HOT] Buona giornata dei single! SALDI -50%💥,Prendilo ORA 👉,💥[HOT] सिंगल्स डे की शुभकामनाएं! बिक्री -50%💥,इसे अभी पकड़ो,💥[HOT] สุขสันต์วันคนโสด! SALE -50%💥,จับเลยตอนนี้👉,💥[PANAS] Selamat Hari Bujang! JUALAN -50%💥,Tangkap SEKARANG 👉,💥 [HOT] يوم سعيد الفردي! بيع -50٪,قبض عليه الآن 👉
