Month,Date,Sale-off,Global,United States,Mexico,Brazil,Russian Federation,Ukraine,Germany,France,Indonesia,"Korea, Republic of",Viet Nam,Japan,Italy,India,Turkey,Thailand,Malaysia,United Arab Emirates
1,1,70%,a,ЁЯТеSuper Sale Happy New Year!ЁЯТе,ЁЯТе┬бSuper Sale Feliz A├▒o Nuevo! ЁЯТе,ЁЯТеSuper venda Feliz Ano Novo! ЁЯТе,ЁЯТе╨б╤Г╨┐╨╡╤А ╤А╨░╤Б╨┐╤А╨╛╨┤╨░╨╢╨░ ╤Б ╨Э╨╛╨▓╤Л╨╝ ╨│╨╛╨┤╨╛╨╝! ЁЯТе,ЁЯТе╨б╤Г╨┐╨╡╤А ╨а╨╛╨╖╨┐╤А╨╛╨┤╨░╨╢ ╨Ч ╨Э╨╛╨▓╨╕╨╝ ╨а╨╛╨║╨╛╨╝!ЁЯТе,ЁЯТеSuper Sale Frohes neues Jahr!ЁЯТе,ЁЯТе Super vente Bonne ann├йe┬а! ЁЯТе,ЁЯТе Penjualan Super Selamat Tahun Baru! ЁЯТе,ЁЯТеьКИэН╝ьД╕ьЭ╝ ьГИэХ┤ ы│╡ ызОьЭ┤ ы░ЫьЬ╝ьД╕ьЪФ!ЁЯТе,ЁЯТе Si├кu Sale Ch├║c Mс╗лng N─Гm Mс╗Ыi! ЁЯТе,ЁЯТеуВ╣уГ╝уГСуГ╝уВ╗уГ╝уГлцШОуБСуБ╛уБЧуБжуБКуВБуБзуБиуБЖуБФуБЦуБДуБ╛уБЩя╝БЁЯТе,ЁЯТеSuper Saldi Felice Anno Nuovo!ЁЯТе,ЁЯТе рд╕реБрдкрд░ рд╕реЗрд▓ рдирдпрд╛ рд╕рд╛рд▓ рдореБрдмрд╛рд░рдХ рд╣реЛ! ЁЯТе,ЁЯТеS├╝per ─░ndirim Mutlu Y─▒llar!ЁЯТе,ЁЯТеSuper Sale р╕кр╕зр╕▒р╕кр╕Фр╕╡р╕Ыр╕╡р╣Гр╕лр╕бр╣И!ЁЯТе,ЁЯТеSuper Sale Selamat Tahun Baru!ЁЯТе,ЁЯТе ╪к╪о┘Б┘К╪╢╪з╪к ┘Б╪з╪ж┘В╪й ╪╣╪з┘Е ╪м╪п┘К╪п ╪│╪╣┘К╪п! ЁЯТе
1,11,70%,a,ЁЯТе Super Sale 11:1 ЁЯТе,ЁЯТе Super Sale 11:1 ЁЯТе,ЁЯТе Super Venda 11:1 ЁЯТе,ЁЯТе ╨б╤Г╨┐╨╡╤А ╤А╨░╤Б╨┐╤А╨╛╨┤╨░╨╢╨░ 11:1 ЁЯТе,ЁЯТе ╨б╤Г╨┐╨╡╤А ╤А╨╛╨╖╨┐╤А╨╛╨┤╨░╨╢ 11:1 ЁЯТе,ЁЯТе Super Sale 11:1 ЁЯТе,ЁЯТе Super Vente 11:1 ЁЯТе,ЁЯТе Penjualan Super 11:1 ЁЯТе,ЁЯТе ьКИэН╝ьД╕ьЭ╝ 11:1 ЁЯТе,ЁЯТе Si├кu Sale 11:1 ЁЯТе,ЁЯТеуВ╣уГ╝уГСуГ╝уВ╗уГ╝уГл11я╝Ъ1ЁЯТе,ЁЯТе Super vendita 11:1 ЁЯТе,ЁЯТе рд╕реБрдкрд░ рд╕реЗрд▓ 11:1 ЁЯТе,ЁЯТе S├╝per ─░ndirim 11:1 ЁЯТе,ЁЯТе р╕ер╕Фр╕гр╕▓р╕Др╕▓р╕Юр╕┤р╣Ар╕ир╕й 11:1 ЁЯТе,ЁЯТе Super Sale 11:1 ЁЯТе,ЁЯТе ╪│┘И╪и╪▒ ╪│┘К┘Д 11: 1 ЁЯТе
2,2,70%,a,ЁЯТе Super Sale 2:2 ЁЯТе,ЁЯТе Super Sale 2:2 ЁЯТе,ЁЯТе Super Venda 2:2 ЁЯТе,ЁЯТе ╨б╤Г╨┐╨╡╤А ╤А╨░╤Б╨┐╤А╨╛╨┤╨░╨╢╨░ 2:2 ЁЯТе,ЁЯТе ╨б╤Г╨┐╨╡╤А ╤А╨╛╨╖╨┐╤А╨╛╨┤╨░╨╢ 2:2 ЁЯТе,ЁЯТе Super Sale 2:2 ЁЯТе,ЁЯТе Super Vente 2:2 ЁЯТе,ЁЯТе Penjualan Super 2:2 ЁЯТе,ЁЯТе ьКИэН╝ьД╕ьЭ╝ 2:2 ЁЯТе,ЁЯТе Si├кu Sale 2:2 ЁЯТе,ЁЯТеуВ╣уГ╝уГСуГ╝уВ╗уГ╝уГл2я╝Ъ2ЁЯТе,ЁЯТе Super vendita 2:2 ЁЯТе,ЁЯТе рд╕реБрдкрд░ рд╕реЗрд▓ 2:2 ЁЯТе,ЁЯТе S├╝per ─░ndirim 2:2 ЁЯТе,ЁЯТе р╕ер╕Фр╕гр╕▓р╕Др╕▓ 2:2 ЁЯТе,ЁЯТе Super Sale 2:2 ЁЯТе,ЁЯТе ╪│┘И╪и╪▒ ╪│┘К┘Д 2: 2 ЁЯТе
2,13-14,70%,a,ЁЯТе Happy Valentine's Day! ЁЯТе,ЁЯТе ┬бFeliz San Valent├нn! ЁЯТе,ЁЯТе Feliz Dia dos Namorados! ЁЯТе,ЁЯТе ╨б ╨Ф╨╜╨╡╨╝ ╤Б╨▓╤П╤В╨╛╨│╨╛ ╨Т╨░╨╗╨╡╨╜╤В╨╕╨╜╨░! ЁЯТе,ЁЯТе ╨Ч ╨Ф╨╜╨╡╨╝ ╨б╨▓╤П╤В╨╛╨│╨╛ ╨Т╨░╨╗╨╡╨╜╤В╨╕╨╜╨░! ЁЯТе,ЁЯТе Alles Gute zum Valentinstag! ЁЯТе,ЁЯТе Joyeuse Saint Valentin ! ЁЯТе,ЁЯТе Selamat Hari Valentine! ЁЯТе,ЁЯТе эХ┤эФ╝ ы░ЬыаМэГАьЭ╕ ыН░ьЭ┤! ЁЯТе,ЁЯТе Ch├║c Bс║бn Ng├аy Lс╗Е T├мnh Nh├вn Hс║бnh Ph├║c! ЁЯТе,ЁЯТеуГПуГГуГФуГ╝уГРуГмуГ│уВ┐уВдуГ│уГЗуГ╝я╝Б ЁЯТе,ЁЯТе Buon San Valentino! ЁЯТе,ЁЯТе рд╣реИрдкреНрдкреА рд╡реЗрд▓реЗрдВрдЯрд╛рдЗрди рдбреЗ! рдореИрдВ ЁЯТе,ЁЯТе Sevgililer G├╝n├╝n├╝z kutlu olsun! ЁЯТе,ЁЯТе р╕кр╕╕р╕Вр╕кр╕▒р╕Щр╕Хр╣Мр╕зр╕▒р╕Щр╕зр╕▓р╣Ар╕ер╕Щр╣Др╕Чр╕Щр╣М! ЁЯТе,ЁЯТе Selamat Hari Valentine! ЁЯТе,ЁЯТе ╪╣┘К╪п ╪н╪и ╪│╪╣┘К╪п! ЁЯТе
3,6-8,70%,a,ЁЯТе Happy Women's Day! ЁЯТе,ЁЯТе ┬бFeliz D├нa de la Mujer! ЁЯТе,ЁЯТе Feliz Dia da Mulher! ЁЯТе,ЁЯТе ╨б ╨╢╨╡╨╜╤Б╨║╨╕╨╝ ╨┤╨╜╨╡╨╝! ЁЯТе,ЁЯТе ╨Ч ╨╢╤Ц╨╜╨╛╤З╨╕╨╝ ╨┤╨╜╨╡╨╝! ЁЯТе,ЁЯТе Alles Gute zum Frauentag! ЁЯТе,ЁЯТе Bonne journ├йe de la femme ! ЁЯТе,ЁЯТе Selamat Hari Perempuan! ЁЯТе,ЁЯТе эЦЙы│╡эХЬ ьЧмьД▒ьЭШ ыВа! ЁЯТе,ЁЯТе Ch├║c Mс╗лng Ng├аy Phс╗е Nс╗п! ЁЯТе,ЁЯТех╣╕уБЫуБкхе│цАзуБоцЧея╝Б ЁЯТе,ЁЯТе Buona festa della donna! ЁЯТе,ЁЯТе рдорд╣рд┐рд▓рд╛ рджрд┐рд╡рд╕ рдХреА рд╢реБрднрдХрд╛рдордирд╛рдПрдВ! рдореИрдВ ЁЯТе,ЁЯТе Kad─▒nlar g├╝n├╝n├╝z kutlu olsun! ЁЯТе,ЁЯТе р╕кр╕╕р╕Вр╕кр╕▒р╕Щр╕Хр╣Мр╕зр╕▒р╕Щр╕кр╕Хр╕гр╕╡! ЁЯТе,ЁЯТе Selamat Hari Wanita! ЁЯТе,ЁЯТе ┘К┘И┘Е ╪│╪╣┘К╪п ┘Д┘Д┘Е╪▒╪г╪й! ЁЯТе
3,23,70%,a,ЁЯТе Super Sale Goodbye March! ЁЯТе,ЁЯТе ┬бSuper Ofertas  Adi├│s Marzo! ЁЯТе,ЁЯТе Super Sale Goodbye March! ЁЯТе,"ЁЯТе ╨б╤Г╨┐╨╡╤А ╤А╨░╤Б╨┐╤А╨╛╨┤╨░╨╢╨░, ╨┐╤А╨╛╤Й╨░╨╣, ╨╝╨░╤А╤В! ЁЯТе",ЁЯТе ╨б╤Г╨┐╨╡╤А ╤А╨╛╨╖╨┐╤А╨╛╨┤╨░╨╢ ╨Ф╨╛ ╨┐╨╛╨▒╨░╤З╨╡╨╜╨╜╤П ╨▒╨╡╤А╨╡╨╖╨╡╨╜╤М! ЁЯТе,ЁЯТе Super Sale Auf Wiedersehen M├дrz! ЁЯТе,ЁЯТе Super Solde Au revoir mars ! ЁЯТе,ЁЯТе Super Sale Selamat tinggal Maret! ЁЯТе,ЁЯТе ьКИэН╝ьД╕ьЭ╝ ъ╡┐ы░ФьЭ┤ 3ьЫФ! ЁЯТе,ЁЯТе Si├кu Sale Tс║бm Biс╗Зt Th├бng 3! ЁЯТе,ЁЯТеуВ╣уГ╝уГСуГ╝уВ╗уГ╝уГлуБХуВИуБЖуБкуВЙуГЮуГ╝уГБя╝Б ЁЯТе,ЁЯТе Super Saldi Arrivederci Marzo! ЁЯТе,ЁЯТе рд╕реБрдкрд░ рд╕реЗрд▓ рдЕрд▓рд╡рд┐рджрд╛ рдорд╛рд░реНрдЪ! рдореИрдВ ЁЯТе,ЁЯТе S├╝per ─░ndirim Elveda Mart! ЁЯТе,ЁЯТе Super Sale р╕Ър╕нр╕Бр╕ер╕▓р╣Ар╕Фр╕╖р╕нр╕Щр╕бр╕╡р╕Щр╕▓р╕Др╕б! ЁЯТе,ЁЯТе Jualan Super Selamat Tinggal Mac! ЁЯТе,ЁЯТе ╪│┘И╪и╪▒ ╪│┘К┘Д ┘И╪п╪з╪╣╪з ┘Е╪з╪▒╪│! ЁЯТе
4,4,70%,a,ЁЯТе Super Sale 4:4 ЁЯТе,ЁЯТе Super Ofertas 4:4 ЁЯТе,ЁЯТе Super Venda 4:4 ЁЯТе,ЁЯТе ╨б╤Г╨┐╨╡╤А ╤А╨░╤Б╨┐╤А╨╛╨┤╨░╨╢╨░ 4:4 ЁЯТе,ЁЯТе ╨б╤Г╨┐╨╡╤А ╤А╨╛╨╖╨┐╤А╨╛╨┤╨░╨╢ 4:4 ЁЯТе,ЁЯТе Super Sale 4:4,ЁЯТе Super Vente 4:4 ЁЯТе,ЁЯТе Penjualan Super 4:4 ЁЯТе,ЁЯТе ьКИэН╝ьД╕ьЭ╝ 4:4 ЁЯТе,ЁЯТе Si├кu Sale 4:4 ЁЯТе,ЁЯТеуВ╣уГ╝уГСуГ╝уВ╗уГ╝уГл4я╝Ъ4ЁЯТе,ЁЯТе Super vendita 4:4 ЁЯТе,ЁЯТе рд╕реБрдкрд░ рд╕реЗрд▓ 4:4 ЁЯТе,ЁЯТе S├╝per ─░ndirim 4:4 ЁЯТе,ЁЯТе р╕ер╕Фр╕кр╕╕р╕Фр╣Ж 4:4 ЁЯТе,ЁЯТе Jualan Super 4:4 ЁЯТе,ЁЯТе ╪│┘И╪и╪▒ ╪│┘К┘Д 4: 4 ЁЯТе
4,20-22,70%,a,ЁЯТе Super Sale for Earth Day! ЁЯТе,ЁЯТе ┬бS├║per oferta para el D├нa de la Tierra! ЁЯТе,ЁЯТе Super Promo├з├гo para o Dia da Terra! ЁЯТе,ЁЯТе ╨б╤Г╨┐╨╡╤А ╤А╨░╤Б╨┐╤А╨╛╨┤╨░╨╢╨░ ╨║╨╛ ╨Ф╨╜╤О ╨Ч╨╡╨╝╨╗╨╕! ЁЯТе,ЁЯТе ╨б╤Г╨┐╨╡╤А ╤А╨╛╨╖╨┐╤А╨╛╨┤╨░╨╢ ╨┤╨╛ ╨Ф╨╜╤П ╨Ч╨╡╨╝╨╗╤Ц! ЁЯТе,ЁЯТе Super Sale zum Tag der Erde! ЁЯТе,ЁЯТе Super vente pour le Jour de la Terre┬а! ЁЯТе,ЁЯТе Obral Super untuk Hari Bumi! ЁЯТе,ЁЯТе ьзАъ╡мьЭШ ыВаьЭД ьЬДэХЬ ьКИэН╝ ьД╕ьЭ╝! ЁЯТе,ЁЯТе Si├кu Sale Nh├вn Ng├аy Tr├бi ─Рс║еt! ЁЯТе,ЁЯТеуВвуГ╝уВ╣уГЗуВдуБоуВ╣уГ╝уГСуГ╝уВ╗уГ╝уГля╝Б ЁЯТе,ЁЯТе Super saldi per la Giornata della Terra! ЁЯТе,ЁЯТе рдкреГрдереНрд╡реА рджрд┐рд╡рд╕ рдХреЗ рд▓рд┐рдП рд╕реБрдкрд░ рд╕реЗрд▓! рдореИрдВ ЁЯТе,ЁЯТе D├╝nya G├╝n├╝ i├зin S├╝per ─░ndirim! ЁЯТе,ЁЯТе р╕ер╕Фр╕гр╕▓р╕Др╕▓р╕зр╕▒р╕Щр╕Др╕╕р╣Йр╕бр╕Др╕гр╕нр╕Зр╣Вр╕ер╕Б! ЁЯТе,ЁЯТе Super Sale untuk Hari Bumi! ЁЯТе,ЁЯТе ╪к╪о┘Б┘К╪╢╪з╪к ┘Г╪и┘К╪▒╪й ┘Д┘К┘И┘Е ╪з┘Д╪г╪▒╪╢! ЁЯТе
5,4-5,70%,a,ЁЯТе Super Sale 5:5 ЁЯТе,ЁЯТе Super Ofertas 5:5 ЁЯТе,ЁЯТе Super Venda 5:5 ЁЯТе,ЁЯТе ╨б╤Г╨┐╨╡╤А ╤А╨░╤Б╨┐╤А╨╛╨┤╨░╨╢╨░ 5:5 ЁЯТе,ЁЯТе ╨б╤Г╨┐╨╡╤А ╤А╨╛╨╖╨┐╤А╨╛╨┤╨░╨╢ 5:5 ЁЯТе,ЁЯТе Super Sale 5:5 ЁЯТе,ЁЯТе Super Vente 5:5 ЁЯТе,ЁЯТе Penjualan Super 5:5 ЁЯТе,ЁЯТе ьКИэН╝ьД╕ьЭ╝ 5:5 ЁЯТе,ЁЯТе Si├кu Sale 5:5 ЁЯТе,ЁЯТеуВ╣уГ╝уГСуГ╝уВ╗уГ╝уГл5я╝Ъ5ЁЯТе,ЁЯТе Super vendita 5:5 ЁЯТе,ЁЯТе рд╕реБрдкрд░ рд╕реЗрд▓ 5:5 ЁЯТе,ЁЯТе S├╝per ─░ndirim 5:5 ЁЯТе,ЁЯТе р╕ер╕Фр╕кр╕╕р╕Фр╣Ж 5:5 ЁЯТе,ЁЯТе Super Sale 5:5 ЁЯТе,ЁЯТе ╪│┘И╪и╪▒ ╪│┘К┘Д 5: 5 ЁЯТе
5,31,70%,a,ЁЯТе Super Sale Goodbye May! ЁЯТе,ЁЯТе ┬бSuper oferta adi├│s mayo! ЁЯТе,ЁЯТе Super Sale Goodbye May! ЁЯТе,"ЁЯТе ╨б╤Г╨┐╨╡╤А ╤А╨░╤Б╨┐╤А╨╛╨┤╨░╨╢╨░, ╨┐╤А╨╛╤Й╨░╨╣, ╨╝╨░╨╣! ЁЯТе","ЁЯТе ╨б╤Г╨┐╨╡╤А ╤А╨╛╨╖╨┐╤А╨╛╨┤╨░╨╢ ╨Ф╨╛ ╨┐╨╛╨▒╨░╤З╨╡╨╜╨╜╤П, ╤В╤А╨░╨▓╨╡╨╜╤М! ЁЯТе",ЁЯТе Super Sale Auf Wiedersehen Mai! ЁЯТе,ЁЯТе Super Solde Au revoir Mai ! ЁЯТе,ЁЯТе Super Sale Selamat tinggal Mei! ЁЯТе,ЁЯТе ьКИэН╝ьД╕ьЭ╝ ъ╡┐ы░ФьЭ┤ 5ьЫФ! ЁЯТе,ЁЯТе Si├кu Sale Tс║бm Biс╗Зt Th├бng 5! ЁЯТе,ЁЯТеуВ╣уГ╝уГСуГ╝уВ╗уГ╝уГлуБХуВИуБЖуБкуВЙ5цЬИя╝Б ЁЯТе,ЁЯТе Super Saldi Arrivederci maggio! ЁЯТе,ЁЯТе рд╕реБрдкрд░ рд╕реЗрд▓ рдЕрд▓рд╡рд┐рджрд╛ рдордИ! рдореИрдВ ЁЯТе,ЁЯТе S├╝per ─░ndirim Elveda May─▒s! ЁЯТе,ЁЯТе Super Sale р╕ер╕▓р╕Бр╣Ир╕нр╕Щр╣Ар╕Фр╕╖р╕нр╕Щр╕Юр╕др╕йр╕ар╕▓р╕Др╕б! ЁЯТе,ЁЯТе Super Sale Selamat tinggal Mei! ЁЯТе,ЁЯТе Super Sale ┘И╪п╪з╪╣╪з╪М ┘Е╪з┘К┘И! ЁЯТе
6,6,70%,a,ЁЯТе Super Sale 6:6 ЁЯТе,ЁЯТе Super Ofertas 6:6 ЁЯТе,ЁЯТе Super Venda 6:6 ЁЯТе,ЁЯТе ╨б╤Г╨┐╨╡╤А ╤А╨░╤Б╨┐╤А╨╛╨┤╨░╨╢╨░ 6:6 ЁЯТе,ЁЯТе ╨б╤Г╨┐╨╡╤А ╤А╨╛╨╖╨┐╤А╨╛╨┤╨░╨╢ 6:6 ЁЯТе,ЁЯТе Super Sale 6:6 ЁЯТе,ЁЯТе Super Vente 6:6 ЁЯТе,ЁЯТе Obral Super 6:6 ЁЯТе,ЁЯТе ьКИэН╝ьД╕ьЭ╝ 6:6 ЁЯТе,ЁЯТе Si├кu Sale 6:6 ЁЯТе,ЁЯТеуВ╣уГ╝уГСуГ╝уВ╗уГ╝уГл6я╝Ъ6ЁЯТе,ЁЯТе Super vendita 6:6 ЁЯТе,ЁЯТе рд╕реБрдкрд░ рд╕реЗрд▓ 6:6 ЁЯТе,ЁЯТе S├╝per ─░ndirim 6:6 ЁЯТе,ЁЯТе р╕ер╕Фр╕кр╕╕р╕Фр╣Ж 6:6 ЁЯТе,ЁЯТе Super Sale 6:6 ЁЯТе,ЁЯТе ╪│┘И╪и╪▒ ╪│┘К┘Д 6: 6 ЁЯТе
6,26,70%,a,ЁЯТе Super Sale Goodbye June! ЁЯТе,ЁЯТе ┬бSuper Ofertas Adi├│s junio! ЁЯТе,ЁЯТе Super Sale Goodbye June! ЁЯТе,"ЁЯТе ╨б╤Г╨┐╨╡╤А ╤А╨░╤Б╨┐╤А╨╛╨┤╨░╨╢╨░, ╨┤╨╛ ╤Б╨▓╨╕╨┤╨░╨╜╨╕╤П, ╨╕╤О╨╜╤М! ЁЯТе","ЁЯТе ╨б╤Г╨┐╨╡╤А ╤А╨╛╨╖╨┐╤А╨╛╨┤╨░╨╢ ╨Ф╨╛ ╨┐╨╛╨▒╨░╤З╨╡╨╜╨╜╤П, ╤З╨╡╤А╨▓╨╡╨╜╤М! ЁЯТе",ЁЯТе Super Sale Auf Wiedersehen Juni! ЁЯТе,ЁЯТе Super Solde Au revoir juin ! ЁЯТе,ЁЯТе Super Sale Selamat tinggal Juni! ЁЯТе,ЁЯТе ьКИэН╝ьД╕ьЭ╝ ъ╡┐ы░ФьЭ┤ 6ьЫФ! ЁЯТе,ЁЯТе Si├кu Sale Tс║бm Biс╗Зt Th├бng 6! ЁЯТе,ЁЯТеуВ╣уГ╝уГСуГ╝уВ╗уГ╝уГлуБХуВИуБЖуБкуВЙ6цЬИя╝Б ЁЯТе,ЁЯТе Super Saldi Arrivederci giugno! ЁЯТе,ЁЯТе рд╕реБрдкрд░ рд╕реЗрд▓ рдЕрд▓рд╡рд┐рджрд╛ рдЬреВрди! рдореИрдВ ЁЯТе,ЁЯТе S├╝per ─░ndirim Elveda Haziran! ЁЯТе,ЁЯТе Super Sale р╕ер╕▓р╕Бр╣Ир╕нр╕Щр╕бр╕┤р╕Цр╕╕р╕Щр╕▓р╕вр╕Щ! ЁЯТе,ЁЯТе Super Sale Selamat tinggal Jun! ЁЯТе,ЁЯТе ╪│┘И╪и╪▒ ╪│┘К┘Д ┘И╪п╪з╪╣╪з ┘К┘И┘Ж┘К┘И! ЁЯТе
7,7,70%,a,ЁЯТе Super Sale 7:7 ЁЯТе,ЁЯТе Super Ofertas 7:7 ЁЯТе,ЁЯТе Super Venda 7:7 ЁЯТе,ЁЯТе ╨б╤Г╨┐╨╡╤А ╤А╨░╤Б╨┐╤А╨╛╨┤╨░╨╢╨░ 7:7 ЁЯТе,ЁЯТе ╨б╤Г╨┐╨╡╤А ╤А╨╛╨╖╨┐╤А╨╛╨┤╨░╨╢ 7:7 ЁЯТе,ЁЯТе Super Sale 7:7 ЁЯТе,ЁЯТе Super Vente 7:7 ЁЯТе,ЁЯТе Obral Super 7:7 ЁЯТе,ЁЯТе 7:7 ьКИэН╝ьД╕ьЭ╝ ЁЯТе,ЁЯТе Si├кu Sale 7:7 ЁЯТе,ЁЯТеуВ╣уГ╝уГСуГ╝уВ╗уГ╝уГл7я╝Ъ7ЁЯТе,ЁЯТе Super vendita 7:7 ЁЯТе,ЁЯТе рд╕реБрдкрд░ рд╕реЗрд▓ 7:7 ЁЯТе,ЁЯТе S├╝per ─░ndirim 7:7 ЁЯТе,ЁЯТе р╕ер╕Фр╕кр╕╕р╕Фр╣Ж 7:7 ЁЯТе,ЁЯТе Super Sale 7:7 ЁЯТе,ЁЯТе ╪и┘К╪╣ ╪│┘И╪и╪▒ 7: 7 ЁЯТе
7,16-18,70%,a,ЁЯТе Super Sale Happy Summer! ЁЯТе,ЁЯТе ┬бSuper Ofertas Feliz Verano! ЁЯТе,ЁЯТе Super Sale Feliz Ver├гo! ЁЯТе,"ЁЯТе ╨б╤Г╨┐╨╡╤А ╤А╨░╤Б╨┐╤А╨╛╨┤╨░╨╢╨░, ╤Б╤З╨░╤Б╤В╨╗╨╕╨▓╨╛╨│╨╛ ╨╗╨╡╤В╨░! ЁЯТе",ЁЯТе ╨б╤Г╨┐╨╡╤А ╤А╨╛╨╖╨┐╤А╨╛╨┤╨░╨╢ ╤Й╨░╤Б╨╗╨╕╨▓╨╛╨│╨╛ ╨╗╤Ц╤В╨░! ЁЯТе,ЁЯТе Super Sale Frohen Sommer! ЁЯТе,ЁЯТе Super Solde Joyeux ├йt├й ! ЁЯТе,ЁЯТе Super Sale Selamat Musim Panas! ЁЯТе,ЁЯТе ьКИэН╝ьД╕ьЭ╝ эХ┤эФ╝ ьЧмыжД! ЁЯТе,ЁЯТе Si├кu Sale Vui H├и! ЁЯТе,ЁЯТеуВ╣уГ╝уГСуГ╝уВ╗уГ╝уГлуГПуГГуГФуГ╝уВ╡уГЮуГ╝я╝Б ЁЯТе,ЁЯТе Super Saldi Buona Estate! ЁЯТе,ЁЯТе рд╕реБрдкрд░ рд╕реЗрд▓ рд╣реИрдкреНрдкреА рд╕рдорд░! рдореИрдВ ЁЯТе,ЁЯТе S├╝per ─░ndirim Mutlu Yazlar! ЁЯТе,ЁЯТе р╕ер╕Фр╕кр╕╕р╕Фр╣Ж р╕Хр╣Йр╕нр╕Щр╕гр╕▒р╕Ър╕Лр╕▒р╕бр╣Ар╕бр╕нр╕гр╣М! ЁЯТе,ЁЯТе Super Sale Selamat Musim Panas! ЁЯТе,ЁЯТе ╪к╪о┘Б┘К╪╢╪з╪к ╪│┘И╪и╪▒ ╪╡┘К┘Б ╪│╪╣┘К╪п! ЁЯТе
7,30,70%,a,ЁЯТе Happy Friendship Day! ЁЯТе,ЁЯТе ┬бFeliz D├нa de la Amistad! ЁЯТе,ЁЯТе Feliz Dia da Amizade! ЁЯТе,ЁЯТе ╨б ╨Ф╨╜╨╡╨╝ ╨┤╤А╤Г╨╢╨▒╤Л! ЁЯТе,ЁЯТе ╨Ч ╨Ф╨╜╨╡╨╝ ╨┤╤А╤Г╨╢╨▒╨╕! ЁЯТе,ЁЯТе Alles Gute zum Tag der Freundschaft! ЁЯТе,ЁЯТе Bonne f├кte de l'amiti├й ! ЁЯТе,ЁЯТе Selamat Hari Persahabatan! ЁЯТе,ЁЯТе эЦЙы│╡эХЬ ьЪ░ьаХьЭШ ыВа! ЁЯТе,ЁЯТе Ch├║c Mс╗лng Ng├аy T├мnh Bс║бn! ЁЯТе,ЁЯТеуГПуГГуГФуГ╝уГХуГмуГ│уГЙуВ╖уГГуГЧуГЗуГ╝я╝Б ЁЯТе,ЁЯТе Buona Giornata dell'Amicizia! ЁЯТе,ЁЯТе рд╣реИрдкреНрдкреА рдлреНрд░реЗрдВрдбрд╢рд┐рдк рдбреЗ! рдореИрдВ ЁЯТе,ЁЯТе Dostluk G├╝n├╝ kutlu olsun! ЁЯТе,ЁЯТе р╕кр╕╕р╕Вр╕кр╕▒р╕Щр╕Хр╣Мр╕зр╕▒р╕Щр╕бр╕┤р╕Хр╕гр╕ар╕▓р╕Ю! ЁЯТе,ЁЯТе Selamat Hari Persahabatan! ЁЯТе,ЁЯТе ╪╣┘К╪п ╪╡╪п╪з┘В╪й ╪│╪╣┘К╪п! ЁЯТе
8,3-5,70%,a,ЁЯТе Back to School Super Sale ЁЯТе,ЁЯТе Super Ofertas D├нa de Regreso a Clases ЁЯТе,ЁЯТе Super oferta de volta ├аs aulas ЁЯТе,ЁЯТе ╨б╤Г╨┐╨╡╤А ╨┐╤А╨╡╨┤╨╗╨╛╨╢╨╡╨╜╨╕╨╡ ╤Б╨╜╨╛╨▓╨░ ╨▓ ╤И╨║╨╛╨╗╤Г ЁЯТе,ЁЯТе ╨б╤Г╨┐╨╡╤А ╨┐╤А╨╡╨┤╨╗╨╛╨╢╨╡╨╜╨╕╨╡ ╤Б╨╜╨╛╨▓╨░ ╨▓ ╤И╨║╨╛╨╗╤Г ЁЯТе,ЁЯТе Back to School Super Sale ЁЯТе,ЁЯТе Super Offre Rentr├йe ЁЯТе,ЁЯТе Penawaran Super Kembali ke Sekolah ЁЯТе,ЁЯТе ы░▒ эИм ьКдь┐и ьКИэН╝ ьД╕ьЭ╝ ЁЯТе,ЁЯТе Si├кu ╞пu ─Р├гi Ng├аy Tс╗▒u Tr╞░с╗Эng ЁЯТе,ЁЯТехнжцабуБлцИ╗уВЛуВ╣уГ╝уГСуГ╝уВкуГХуВбуГ╝ЁЯТе,ЁЯТе Super Offerta Ritorno a Scuola ЁЯТе,ЁЯТе рдмреИрдХ рдЯреВ рд╕реНрдХреВрд▓ рдкрд░ рд╕реБрдкрд░ рдЫреВрдЯ ЁЯТе,ЁЯТе Okula D├╢n├╝┼Я S├╝per F─▒rsat─▒ ЁЯТе,ЁЯТе р╕Вр╣Йр╕нр╣Ар╕кр╕Щр╕нр╕кр╕╕р╕Фр╕Юр╕┤р╣Ар╕ир╕й Back to School ЁЯТе,ЁЯТе Tawaran Super Kembali ke Sekolah ЁЯТе,ЁЯТе ╪╣╪▒╪╢ ╪│┘И╪и╪▒ ┘Б┘К ┘К┘И┘Е ╪з┘Д┘Е╪п╪▒╪│╪й ЁЯТе
8,20-22,70%,a,ЁЯТе Big Sale August ЁЯТе,ЁЯТе Gran ofertas de agosto ЁЯТе,ЁЯТе Grande promo├з├гo em agosto ЁЯТе,ЁЯТе ╨С╨╛╨╗╤М╤И╨░╤П ╤А╨░╤Б╨┐╤А╨╛╨┤╨░╨╢╨░ ╨▓ ╨░╨▓╨│╤Г╤Б╤В╨╡ ЁЯТе,ЁЯТе ╨Т╨╡╨╗╨╕╨║╨╕╨╣ ╤А╨╛╨╖╨┐╤А╨╛╨┤╨░╨╢ ╤Г ╤Б╨╡╤А╨┐╨╜╤Ц ЁЯТе,ЁЯТе Gro├Яer Verkauf August ЁЯТе,ЁЯТе Grande Vente Ao├╗t ЁЯТе,ЁЯТе Obral Besar Agustus ЁЯТе,ЁЯТе 8ьЫФ ы╣ЕьД╕ьЭ╝ ЁЯТе,ЁЯТе ╞пu ─Р├гi Lс╗Ыn Th├бng 8 ЁЯТе,ЁЯТеуГУуГГуВ░уВ╗уГ╝уГл8цЬИЁЯТе,ЁЯТе Grande Saldo Agosto ЁЯТе,ЁЯТе рдмрдбрд╝реА рдмрд┐рдХреНрд░реА рдЕрдЧрд╕реНрдд ЁЯТе,ЁЯТе B├╝y├╝k ─░ndirim A─Яustos ЁЯТе,ЁЯТе р╕ер╕Фр╕гр╕▓р╕Др╕▓р╕Др╕гр╕▒р╣Йр╕Зр╣Гр╕лр╕Нр╣И р╣Ар╕Фр╕╖р╕нр╕Щр╕кр╕┤р╕Зр╕лр╕▓р╕Др╕б ЁЯТе,ЁЯТе Jualan Besar Ogos ЁЯТе,ЁЯТе ╪к╪о┘Б┘К╪╢╪з╪к ┘Г╪и┘К╪▒╪й ┘Б┘К ╪г╪║╪│╪╖╪│ ЁЯТе
9,9,70%,a,ЁЯТе Super Sale 9:9 ЁЯТе,ЁЯТе Super Ofertas 9:9 ЁЯТе,ЁЯТе Super Venda 9:9 ЁЯТе,ЁЯТе ╨б╤Г╨┐╨╡╤А ╤А╨░╤Б╨┐╤А╨╛╨┤╨░╨╢╨░ 9:9 ЁЯТе,ЁЯТе ╨б╤Г╨┐╨╡╤А ╤А╨╛╨╖╨┐╤А╨╛╨┤╨░╨╢ 9:9 ЁЯТе,ЁЯТе Super Sale 9:9 ЁЯТе,ЁЯТе Super Vente 9:9 ЁЯТе,ЁЯТе Penjualan Super 9:9 ЁЯТе,ЁЯТе ьКИэН╝ьД╕ьЭ╝ 9:9 ЁЯТе,ЁЯТе Si├кu Sale 9:9 ЁЯТе,ЁЯТеуВ╣уГ╝уГСуГ╝уВ╗уГ╝уГл9я╝Ъ9ЁЯТе,ЁЯТе Super vendita 9:9 ЁЯТе,ЁЯТе рд╕реБрдкрд░ рд╕реЗрд▓ 9:9 ЁЯТе,ЁЯТе S├╝per ─░ndirim 9:9 ЁЯТе,ЁЯТе р╕ер╕Фр╕гр╕▓р╕Др╕▓р╕кр╕╕р╕Фр╣Ж 9:9 ЁЯТе,ЁЯТе Super Sale 9:9 ЁЯТе,ЁЯТе ╪│┘И╪и╪▒ ╪│┘К┘Д 9: 9 ЁЯТе
9,27-30,70%,a,ЁЯТе Super Sale Goodbye September! ЁЯТе,ЁЯТе Super Ofertas ┬бAdi├│s septiembre! ЁЯТе,ЁЯТе Super Sale Goodbye September! ЁЯТе,"ЁЯТе ╨б╤Г╨┐╨╡╤А ╤А╨░╤Б╨┐╤А╨╛╨┤╨░╨╢╨░, ╨┤╨╛ ╤Б╨▓╨╕╨┤╨░╨╜╨╕╤П, ╤Б╨╡╨╜╤В╤П╨▒╤А╤М! ЁЯТе","ЁЯТе ╨б╤Г╨┐╨╡╤А ╤А╨╛╨╖╨┐╤А╨╛╨┤╨░╨╢ ╨Ф╨╛ ╨┐╨╛╨▒╨░╤З╨╡╨╜╨╜╤П, ╨▓╨╡╤А╨╡╤Б╨╡╨╜╤М! ЁЯТе",ЁЯТе Super Sale Auf Wiedersehen September! ЁЯТе,ЁЯТе Super Solde Au revoir septembre ! ЁЯТе,ЁЯТе Super Sale Selamat tinggal September! ЁЯТе,ЁЯТе ьКИэН╝ьД╕ьЭ╝ ъ╡┐ы░ФьЭ┤ 9ьЫФ! ЁЯТе,ЁЯТе Si├кu Sale Tс║бm Biс╗Зt Th├бng 9! ЁЯТе,ЁЯТеуВ╣уГ╝уГСуГ╝уВ╗уГ╝уГлуБХуВИуБЖуБкуВЙ9цЬИя╝Б ЁЯТе,ЁЯТе Super Saldi Arrivederci Settembre! ЁЯТе,ЁЯТе рд╕реБрдкрд░ рд╕реЗрд▓ рдЕрд▓рд╡рд┐рджрд╛ рд╕рд┐рддрдВрдмрд░! рдореИрдВ ЁЯТе,ЁЯТе S├╝per ─░ndirim Elveda Eyl├╝l! ЁЯТе,ЁЯТе Super Sale р╕Ър╕нр╕Бр╕ер╕▓р╕Бр╕▒р╕Щр╕вр╕▓р╕вр╕Щ! ЁЯТе,ЁЯТе Super Sale Selamat tinggal September! ЁЯТе,ЁЯТе ╪к╪о┘Б┘К╪╢╪з╪к ╪│┘И╪и╪▒ ┘И╪п╪з╪╣╪з ╪│╪и╪к┘Е╪и╪▒! ЁЯТе
10,10,70%,a,ЁЯТе Super Sale 10:10 ЁЯТе,ЁЯТе Super Ofertas 10:10 ЁЯТе,ЁЯТе Super Sale 10:10 ЁЯТе,ЁЯТе ╨б╤Г╨┐╨╡╤А ╤А╨░╤Б╨┐╤А╨╛╨┤╨░╨╢╨░ 10:10 ЁЯТе,ЁЯТе ╨б╤Г╨┐╨╡╤А ╤А╨╛╨╖╨┐╤А╨╛╨┤╨░╨╢ 10:10 ЁЯТе,ЁЯТе Super Sale 10:10 ЁЯТе,ЁЯТе Super Vente 10:10 ЁЯТе,ЁЯТе Obral Super 10:10 ЁЯТе,ЁЯТе ьКИэН╝ьД╕ьЭ╝ 10:10 ЁЯТе,ЁЯТе Si├кu Sale 10:10 ЁЯТе,ЁЯТеуВ╣уГ╝уГСуГ╝уВ╗уГ╝уГл10я╝Ъ10ЁЯТе,ЁЯТе Super vendita 10:10 ЁЯТе,ЁЯТе рд╕реБрдкрд░ рд╕реЗрд▓ 10:10 ЁЯТе,ЁЯТе S├╝per ─░ndirim 10:10 ЁЯТе,ЁЯТе р╕ер╕Фр╕гр╕▓р╕Др╕▓р╕кр╕╕р╕Фр╣Ж 10:10 ЁЯТе,ЁЯТе Super Sale 10:10 ЁЯТе,ЁЯТе ╪│┘И╪и╪▒ ╪│┘К┘Д 10:10 ЁЯТе
