Month,Date,Sale-off,Global,United States,Mexico,Brazil,Russian Federation,Ukraine,Germany,France,Indonesia,"Korea, Republic of",Viet Nam,Japan,Italy,India,Turkey,Thailand,Malaysia,United Arab Emirates
10,30-31,70%,a,ЁЯТе Super Sale Happy Halloween! ЁЯТе,ЁЯТе ┬бSuper Ofertas Feliz Halloween! ЁЯТе,ЁЯТе Super Venda Feliz Dia das Bruxas! ЁЯТе,ЁЯТе ╨б╤Г╨┐╨╡╤А ╤А╨░╤Б╨┐╤А╨╛╨┤╨░╨╢╨░ ╤Б ╨е╨╡╨╗╨╗╨╛╤Г╨╕╨╜╨╛╨╝! ЁЯТе,ЁЯТе ╨б╤Г╨┐╨╡╤А ╤А╨╛╨╖╨┐╤А╨╛╨┤╨░╨╢ ╨й╨░╤Б╨╗╨╕╨▓╨╛╨│╨╛ ╨е╨╡╨╗╨╗╨╛╤Г╤Ч╨╜╨░! ЁЯТе,ЁЯТе Super Sale Frohes Halloween! ЁЯТе,ЁЯТе Super Solde Joyeux Halloween ! ЁЯТе,ЁЯТе Super Sale Selamat Halloween! ЁЯТе,ЁЯТе ьКИэН╝ьД╕ьЭ╝ эХ┤эФ╝ эХаыбЬьЬИ! ЁЯТе,ЁЯТе Si├кu Sale Mс╗лng Halloween! ЁЯТе,ЁЯТеуВ╣уГ╝уГСуГ╝уВ╗уГ╝уГлуГПуГГуГФуГ╝уГПуГнуВжуВгуГ│я╝Б ЁЯТе,ЁЯТе Super Saldi Buon Halloween! ЁЯТе,ЁЯТе рд╕реБрдкрд░ рд╕реЗрд▓ рд╣реИрдкреНрдкреА рд╣реИрд▓реЛрд╡реАрди! рдореИрдВ ЁЯТе,ЁЯТе S├╝per ─░ndirim Cad─▒lar Bayram─▒n─▒z Kutlu Olsun! ЁЯТе,ЁЯТе р╕ер╕Фр╕кр╕╕р╕Фр╣Ж р╕кр╕╕р╕Вр╕кр╕▒р╕Щр╕Хр╣Мр╕зр╕▒р╕Щр╕ор╕▓р╣Вр╕ер╕зр╕╡р╕Щ! ЁЯТе,ЁЯТе Super Sale Selamat Halloween! ЁЯТе,ЁЯТе ╪│┘И╪и╪▒ ╪к╪о┘Б┘К╪╢╪з╪к ╪│╪╣┘К╪п╪й ┘З╪з┘Д┘И┘К┘Ж! ЁЯТе
11,11,70%,a,ЁЯТе Super Sale Happy Singles' Day! ЁЯТе,ЁЯТе ┬бFeliz d├нa de los solteros de Super Sale! ЁЯТе,ЁЯТе Super Sale Feliz Dia dos Solteiros! ЁЯТе,ЁЯТе ╨б╤Г╨┐╨╡╤А ╤А╨░╤Б╨┐╤А╨╛╨┤╨░╨╢╨░ ╤Б ╨Ф╨╜╨╡╨╝ ╤Е╨╛╨╗╨╛╤Б╤В╤П╨║╨╛╨▓! ЁЯТе,ЁЯТе ╨б╤Г╨┐╨╡╤А╤А╨╛╨╖╨┐╤А╨╛╨┤╨░╨╢ ╨╖ ╨Ф╨╜╨╡╨╝ ╤Е╨╛╨╗╨╛╤Б╤В╤П╨║╤Ц╨▓! ЁЯТе,ЁЯТе Super Sale Happy Singles' Day! ЁЯТе,ЁЯТе Super vente Bonne f├кte des c├йlibataires┬а! ЁЯТе,ЁЯТе Super Sale Selamat Hari Jomblo! ЁЯТе,ЁЯТе ьКИэН╝ьД╕ьЭ╝ эХ┤эФ╝ ьЛ▒ъ╕АьЭШ ыВа! ЁЯТе,ЁЯТе Si├кu Sale Mс╗лng Tс║┐t ─Рс╗Щc Th├вn! ЁЯТе,ЁЯТеуВ╣уГ╝уГСуГ╝уВ╗уГ╝уГлуГПуГГуГФуГ╝уВ╖уГ│уВ░уГлуВ╣уГЗуГ╝я╝Б ЁЯТе,ЁЯТе Super vendita Buona festa dei single! ЁЯТе,ЁЯТе рд╕реБрдкрд░ рд╕реЗрд▓ рд╣реИрдкреНрдкреА рд╕рд┐рдВрдЧрд▓реНрд╕ рдбреЗ! рдореИрдВ ЁЯТе,ЁЯТе S├╝per ─░ndirim Bekarlar G├╝n├╝n├╝z Kutlu Olsun! ЁЯТе,ЁЯТе Super Sale р╕кр╕╕р╕Вр╕кр╕▒р╕Щр╕Хр╣Мр╕зр╕▒р╕Щр╕Др╕Щр╣Вр╕кр╕Ф! ЁЯТе,ЁЯТе Super Sale Selamat Hari Bujang! ЁЯТе,ЁЯТе ╪│┘И╪и╪▒ ╪к╪о┘Б┘К╪╢╪з╪к ╪│╪╣┘К╪п╪й ┘К┘И┘Е ╪з┘Д┘Б╪▒╪п┘К! ЁЯТе
11,26,70%,a,ЁЯТе Super Sale Black Friday ЁЯТе,ЁЯТе Super Ofertas Black Friday ЁЯТе,ЁЯТе Super Sale Black Friday ЁЯТе,ЁЯТе ╨б╤Г╨┐╨╡╤А ╤А╨░╤Б╨┐╤А╨╛╨┤╨░╨╢╨░ Black Friday ЁЯТе,ЁЯТе ╨б╤Г╨┐╨╡╤А ╤А╨░╤Б╨┐╤А╨╛╨┤╨░╨╢╨░ Black Friday ЁЯТе,ЁЯТе Super Sale Black Friday ЁЯТе,ЁЯТе Super Vente Black Friday ЁЯТе,ЁЯТе Super Sale Black Friday ЁЯТе,ЁЯТе ьКИэН╝ьД╕ьЭ╝ Black Friday ЁЯТе,ЁЯТе Si├кu Sale Black Friday ЁЯТе,ЁЯТеуВ╣уГ╝уГСуГ╝уВ╗уГ╝уГл Black Friday ЁЯТе,ЁЯТе Super Saldi Black Friday ЁЯТе,ЁЯТе рд╕реБрдкрд░ рд╕реЗрд▓ Black Friday ЁЯТе,ЁЯТе S├╝per ─░ndirim Black Friday ЁЯТе,ЁЯТе Super Sale Black Friday ЁЯТе,ЁЯТе Super Sale Black Friday ЁЯТе,ЁЯТе ╪│┘И╪и╪▒ ╪к╪о┘Б┘К╪╢╪з╪к Black Friday ЁЯТе
11,29,70%,a,ЁЯТе Super Sale Cyber Monday ЁЯТе ,ЁЯТе Super Sale Cyber Monday ЁЯТе,ЁЯТе Super Sale Cyber Monday ЁЯТе,ЁЯТе ╨б╤Г╨┐╨╡╤А ╤А╨░╤Б╨┐╤А╨╛╨┤╨░╨╢╨░ Cyber Monday ЁЯТе,ЁЯТе ╨б╤Г╨┐╨╡╤А ╤А╨░╤Б╨┐╤А╨╛╨┤╨░╨╢╨░ Cyber Monday ЁЯТе,ЁЯТе Super Sale Cyber Monday ЁЯТе,ЁЯТе Super Solde Cyber Monday ЁЯТе,ЁЯТе Super Sale Cyber Monday ЁЯТе,ЁЯТе ьКИэН╝ьД╕ьЭ╝ Cyber Monday ЁЯТе,ЁЯТе Si├кu Giс║гm Gi├б Cyber Monday ЁЯТе,ЁЯТеуВ╣уГ╝уГСуГ╝уВ╗уГ╝уГл Cyber Monday ЁЯТе,ЁЯТе Cyber Monday Super Sale ЁЯТе,ЁЯТе рд╕реБрдкрд░ рд╕реЗрд▓ Cyber Monday ЁЯТе,ЁЯТе S├╝per ─░ndirim Cyber Monday ЁЯТе,ЁЯТе Super Sale Cyber Monday ЁЯТе,ЁЯТе Super Sale Cyber Monday ЁЯТе,ЁЯТе ╪з┘Д╪к╪о┘Б┘К╪╢╪з╪к ╪з┘Д┘Б╪з╪ж┘В╪й Cyber Monday ЁЯТе
12,12,70%,a,ЁЯТе Super Sale 12:12 ЁЯТе,ЁЯТе Super Ofertas 12:12 ЁЯТе,ЁЯТе Super Sale 12:12 ЁЯТе,ЁЯТе ╨б╤Г╨┐╨╡╤А ╤А╨░╤Б╨┐╤А╨╛╨┤╨░╨╢╨░ 12:12 ЁЯТе,ЁЯТе ╨б╤Г╨┐╨╡╤А ╤А╨╛╨╖╨┐╤А╨╛╨┤╨░╨╢ 12:12 ЁЯТе,ЁЯТе Super Sale 12:12 ЁЯТе,ЁЯТе Super Vente 12:12 ЁЯТе,ЁЯТе Obral Super 12:12 ЁЯТе,ЁЯТе ьКИэН╝ьД╕ьЭ╝ 12:12 ЁЯТе,ЁЯТе Si├кu Sale 12:12 ЁЯТе,ЁЯТеуВ╣уГ╝уГСуГ╝уВ╗уГ╝уГл12я╝Ъ12ЁЯТе,ЁЯТе Super vendita 12:12 ЁЯТе,ЁЯТе рд╕реБрдкрд░ рд╕реЗрд▓ 12:12 ЁЯТе,ЁЯТе S├╝per ─░ndirim 12:12 ЁЯТе,ЁЯТе р╕ер╕Фр╕кр╕╕р╕Фр╣Ж 12:12 ЁЯТе,ЁЯТе Super Sale 12:12 ЁЯТе,ЁЯТе ╪│┘И╪и╪▒ ╪│┘К┘Д 12:12 ЁЯТе
12,24-25,70%,a,ЁЯТе Super Sale Merry Christmas! ЁЯТе,ЁЯТе ┬бSSuper Ofertas Feliz Navidad! ЁЯТе,ЁЯТе Super Sale Feliz Natal! ЁЯТе,ЁЯТе ╨б╤Г╨┐╨╡╤А ╤А╨░╤Б╨┐╤А╨╛╨┤╨░╨╢╨░ ╤Б ╨а╨╛╨╢╨┤╨╡╤Б╤В╨▓╨╛╨╝! ЁЯТе,ЁЯТе ╨б╤Г╨┐╨╡╤А ╤А╨╛╨╖╨┐╤А╨╛╨┤╨░╨╢ ╨╖ ╨а╤Ц╨╖╨┤╨▓╨╛╨╝! ЁЯТе,ЁЯТе Super Sale Frohe Weihnachten! ЁЯТе,ЁЯТе Super Solde Joyeux No├лl ! ЁЯТе,ЁЯТе Penjualan Super Selamat Natal! ЁЯТе,ЁЯТе ьКИэН╝ьД╕ьЭ╝ ыйФыжм эБмыжмьКдызИьКд! ЁЯТе,ЁЯТе Si├кu Sale Mс╗лng Gi├бng Sinh! ЁЯТе,ЁЯТеуВ╣уГ╝уГСуГ╝уВ╗уГ╝уГлуГбуГкуГ╝уВпуГкуВ╣уГЮуВ╣я╝Б ЁЯТе,ЁЯТе Super Saldi Buon Natale! ЁЯТе,ЁЯТе рд╕реБрдкрд░ рд╕реЗрд▓ рдореЗрд░реА рдХреНрд░рд┐рд╕рдорд╕! рдореИрдВ ЁЯТе,ЁЯТе S├╝per ─░ndirim Mutlu Noeller! ЁЯТе,ЁЯТе Super Sale р╕кр╕╕р╕Вр╕кр╕▒р╕Щр╕Хр╣Мр╕зр╕▒р╕Щр╕Др╕гр╕┤р╕кр╕Хр╣Мр╕бр╕▓р╕к! ЁЯТе,ЁЯТе Super Sale Selamat Hari Natal! ЁЯТе,ЁЯТе ╪│┘И╪и╪▒ ╪и┘К╪╣ ╪╣┘К╪п ┘Е┘К┘Д╪з╪п ╪│╪╣┘К╪п! ЁЯТе